{
  "categoria": "acordao",
  "sessao": "20 de março de 2025",
  "numero": "46.875",
  "publicacao": "1/4/2025",
  "numero_diario": "1.921",
  "processo": "018338.2023.2.000",
  "município": "Muaná",
  "órgão": "FUNDO MUNICIPAL DE ASSISTÊNCIA SOCIAL – FMAS",
  "assunto": "Recurso Ordinário Decisão",
  "exercício": "2014",
  "ordenadora": "JOSELICE CARAMES DE MELO – CPF Nº 643.295.182-87",
  "contadores": "FÁBIO PANTOJA DE SOUZA – CRC/PA Nº 11.233 PAULO SÉRGIO FADUL NEVES – CRC/PA Nº 8.812",
  "mpc": "PROCURADORA ELISABETH MASSOUD SALAME DA SILVA",
  "relator": "Conselheiro Luis Daniel Lavareda Reis Junior Membro/",
  "decisão": "I – JULGAR REGULARES COM RESSALVAS, com fundamento no art. 45, II, da Lei Complementar nº 109/2016, as contas do FUNDO MUNICIPAL DE ASSISTÊNCIA SOCIAL DE BREVES, exercício financeiro de 2023, de responsabilidades de JOSELICE CARAMES DE MELO; II – APLICAR MULTA na quantidade de 200 (duzentas) UPF/PA – Unidades de Padrão Fiscal do Estado do Pará, prevista no inciso I do art. 700 do Regimento Interno deste Tribunal, pela remessa intempestiva dos arquivos contábeis dos meses de janeiro e fevereiro, e dos arquivos de folha de pagamento dos meses de janeiro, fevereiro e março, descumprindo o art. 6º inciso I da Instrução Normativa nº 002/2019/TCM/PA; III – ADVERTIR a Ordenadora, que em caso de não recolhimento da multa no prazo estipulado, ficará passível dos acréscimos decorrentes da mora, com base no art. 703, I, II, III, do RI/TCM-PA; IV – EXPEDIR o competente Alvará de Quitação à Ordenadora, pelas despesas ordenadas, no montante de R$-11.681.842,46 (onze milhões e seiscentos e oitenta e um mil e oitocentos e quarenta e dois reais e quarenta e seis centavos), onde se inclui o valor de R$-526.043,58 (quinhentos e vinte e seis mil e quarenta e três reais e cinquenta e oito centavos) de saldo em bancos para o exercício seguinte, condicionado a comprovação do recolhimento da multa aplicada. Sessão do Pleno do Tribunal de Contas dos Municípios do Estado do Pará, 20 de março de 2025.",
  "protocolo": "52558 Download Anexo - Relatório e Voto do Relator RESOLUÇÃO RESOLUÇÃO Nº 17.162/2025 Processo nº 202001389-00 (PC 490012014-00)",
  "recorrida": "Resolução nº 15.208, de 28/01/2020, que emitiu Parecer Prévio Contrário à Aprovação da Prestação de Contas de Governo",
  "responsável": "FRANCISCO MARCOLINO DE ALMEIDA – CPF: 728.078.812-20",
  "advogado": "Sem Advogado Constituído",
  "mpcm": "Erika Monique Paraense",
  "ementa": "RECURSO ORDINÁRIO. PRESTAÇÃO DE CONTAS ANUAIS DE GOVERNO. MUNICÍPIO DE MUANÁ. EXERCÍCIO 2014. PELO CONHECIMENTO. PROVIMENTO PARCIAL DO RECURSO. AFASTAR A FALHA PELO DESCUMPRIMENTO AO ART. 60, IV, DO ADCT. MANTIDA A DECISÃO CONTIDA NA RESOLUÇÃO Nº 15.208/2020 QUE EMITIU PARECER PRÉVIO RECOMENDANDO AO LEGISLATIVO MUNICIPAL A NÃO APROVAÇÃO DAS CONTAS. UNANIMIDADE. MANUTENÇÃO DA MULTA APLICADA. Vistos, relatados e discutidos os autos que tratam do Recurso Ordinário impetrado pelo Sr. Sérgio Murilo dos Santos Guimarães, ex-prefeito do município de Muaná, exercício 2014, contra decisão contida na Resolução nº 15.208/2020, que emitiu parecer prévio pela irregularidade das contas, Resolvem os Conselheiros do Tribunal de Contas dos Municípios do Estado do Pará, nos termos da Ata da sessão e do Relatório e Voto do Conselheiro Relator, por unanimidade, DECISÃO: Pelo CONHECIMENTO, e no mérito, pelo PROVIMENTO PARCIAL do Recurso interposto, para afastar a falha pelo descumprimento ao art. 60, IV, do ADCT e art. 11 da Lei nº 11.494/2007, mantendo-se os termos da Resolução nºTerça-feira, 01 de abril de 2025 DOE TCMPA Nº 1.921 12 Consulta via leitora de QR Code/ Este Diário Oficial Eletrônico do TCMPA é GRATUITO e sua autenticidade poderá ser confirmada na página do Tribunal de Contas dos Municípios do Estado do Pará na Internet, no Endereço: diario-oficial-eletronico/ 15.208/2020-TCM/PA, pela emissão de Parecer Prévio contrário a aprovação das Contas de Governo da Prefeitura Municipal de Muaná, exercício de 2014, pelo descumprimento ao art. 20, III, “b” e art. 19, III, da Lei de Responsabilidade Fiscal, com a manutenção das multas fixadas. Sessão Plenária Ordinária do Tribunal de Contas dos Municípios do Estado do Pará, em 23/01/2025. Download Anexo - Relatório e Voto do Relator RESOLUÇÃO Nº 17.207 PROCESSO E-",
  "tcm": "1.093276.2018.2.0003 - (SPE Nº 093276.2018.2.000) MUNICÍPIO: GARRAFÃO DO NORTE ÓRGÃO: FUNDO MUNICIPAL DE SAÚDE EXERCÍCIO: 2018 ASSUNTO: CONTAS ANUAIS DE GESTÃO REABERTURA DE INSTRUÇÃO PROCESSUAL",
  "contador": "Roosevelt José da Silva Sousa - Contador - SRF 32441142291 02) Processo nº 003001.2019.1.000 Ordenador: Sr(a). ODIMAR WANDERLEY SALOMAO - CPF: 226.543.642-91 Origem: PREFEITURA MUNICIPAL DE AFUA - AFUA Assunto: CONTAS ANUAIS CHEFE DO EXECUTIVO Exercício: 2019 Ministério Público: Procurador Sr. Marcelo Fonseca Barros Relator: Conselheiro Luis Daniel Lavareda Reis Junior Advogado/Contador: RAIMUNDO EDSON DE AMORIM SANTOS - CONTADOR - SEGUP-PA 3785022 03) Processo nº 810012011-00 Ordenador: Sr(a). CLETO JOSÉ ALVES DA SILVA - CPF: 041.649.382-34 Origem: PREFEITURA MUNICIPAL DE SENADOR JOSE PORFIRIO - SENADOR JOSE PORFIRIO Assunto: CONTAS ANUAIS CHEFE DO EXECUTIVO Exercício: 2011 Ministério Público: Procuradora Sra. Maria Regina Franco Cunha Relator: Conselheira Mara Lúcia Barbalho da Cruz 04) Processo nº 810012012-00 Ordenador: Sr(a). CLETO JOSÉ ALVES DA SILVA - CPF: 041.649.382-34 Origem: PREFEITURA MUNICIPAL DE SENADOR JOSE PORFIRIO - SENADOR JOSE PORFIRIO Assunto: CONTAS ANUAIS DE GESTÃO Exercício: 2012 Ministério Público: Procuradora Sra. Elisabeth Massoud Salame da Silva Relator: Conselheira Mara Lúcia Barbalho da Cruz 05) Processo nº 043001.2017.1.000 Ordenador: Sr(a). RAIMUNDA DA COSTA ARAUJO - CPF: 038.817.762-49 Origem: PREFEITURA MUNICIPAL DE MARACANA - MARACANA Assunto: CONTAS ANUAIS CHEFE DO EXECUTIVO Exercício: 2017 Ministério Público: Procuradora Sra. Elisabeth Massoud Salame da Silva Relator: Conselheiro Antonio José Costa de Freitas Guimarães 06) Processo nº 061001.2020.1.000 Ordenador: Sr(a). ANA RENATA BRITO DE SOUSA - CPF: 665.578.602-91 Origem: PREFEITURA MUNICIPAL DE PRIMAVERA - PRIMAVERA Assunto: CONTAS ANUAIS CHEFE DO EXECUTIVO Exercício: 2020 Ministério Público: Procuradora Sra. Maria Regina Franco Cunha Relator: Conselheiro Antonio José Costa de Freitas Guimarães Advogado/Contador: ANA RENATA BRITO DE SOUSA - PREFEITO - ssp/pa 3042335 07) Processo nº 032006.2023.2.000 Ordenador: Sr(a). ALDECY VITOR DE OLIVEIRA JUNIOR - CPF: 621.387.232-91Terça-feira, 01 de abril de 2025 DOE TCMPA Nº 1.921 14 Consulta via leitora de QR Code/ Este Diário Oficial Eletrônico do TCMPA é GRATUITO e sua autenticidade poderá ser confirmada na página do Tribunal de Contas dos Municípios do Estado do Pará na Internet, no Endereço: diario-oficial-eletronico/ Origem: FUNDO MUNICIPAL DE EDUCACAO - IGARAPE-ACU Assunto: CONTAS ANUAIS DE GESTÃO Exercício: 2023 Ministério Público: Procuradora Sra. Erika Monique Paraense Serra Vasconcellos Relator: Conselheiro José Carlos Araújo Advogado/Contador: MARCUS PLINIO GARCIA DE LIMA - CONTADOR - SSP 2854493 08) Processo nº 056020.2023.2.000 Ordenador: Sr(a). LEISE VIEIRA DE MESQUITA - CPF: 843.683.81220 Origem: FUNDO MUN DE EDUCACAO - PEIXE-BOI Assunto: CONTAS ANUAIS DE GESTÃO Exercício: 2023 Ministério Público: Procuradora Sra. Erika Monique Paraense Serra Vasconcellos Relator: Conselheiro José Carlos Araújo Advogado/Contador: ROMULO VICTOR DE LIMA MELO - CONTADOR - CRC-PA 15562 09) Processo nº 061420.2023.2.000 Ordenador: Sr(a). PAULO HENRIQUE RIBEIRO DA COSTA - CPF: 023.095.702-14 Origem: FUNDO MUNICIPAL DE EDUCAÇÃO - FME - PRIMAVERA Assunto: CONTAS ANUAIS DE GESTÃO Exercício: 2023 Ministério Público: Procurador Sr. Marcelo Fonseca Barros Relator: Conselheiro José Carlos Araújo Advogado/Contador: VINICIUS NAZARENO GARCIA DE LIMA - CONTADOR - CRC-PA 14352 10) Processo nº 141010.2023.2.000 Ordenador: Sr(a). MAGALI SORAIA BARATA LIMA - CPF: 305.789.492-53 Origem: FUNDO MUNICIPAL DE EDUCACAO - QUATIPURU Assunto: CONTAS ANUAIS DE GESTÃO Exercício: 2023 Ministério Público: Procuradora Sra. Maria Regina Franco Cunha Relator: Conselheiro José Carlos Araújo Advogado/Contador: RANDSON ANDRE SILVA FERREIRA - CONTADOR - SSP 5897060 11) Processo nº 480032012-00 Ordenador: Sr(a). JARDEL VASCONCELOS CARMO - CPF: 033.916.122-15 Origem: FUNDO MUNIC. DE ASSISTENCIA SOCIAL - MONTE ALEGRE Assunto: CONTAS ANUAIS DE GESTÃO Exercício: 2012 Ministério Público: Procuradora Sra. Maria Inez Klautau de Mendonça Gueiros Relator: Conselheira Mara Lúcia Barbalho da Cruz 12) Processo nº 124447.2019.2.000 Ordenador: Sr(a). PEDRO PATRICIO DE MEDEIROS - CPF: 443.471.709-04, VICENTE ALVES CARDOSO - CPF: 429.829.442-00 Origem: FUNDO MUNICIPAL DE EDUCACAO - SAO DOMINGOS DO ARAGUAIA Assunto: CONTAS ANUAIS DE GESTÃO Exercício: 2019 Ministério Público: Procuradora Sra. Maria Regina Franco Cunha Relator: Conselheira Mara Lúcia Barbalho da Cruz Advogado/Contador: VICENTE ALVES CARDOSO - ORDENADOR - PC 2268567, PEDRO PATRICIO DE MEDEIROS - ORDENADOR - SSP/PA 31809959 13) Processo nº 139012.2019.2.000 Ordenador: Sr(a). LAANE BARROS LUCENA - CPF: 989.972.201-44 Origem: SECRETARIA MUNICIPAL DE EDUCACAO - PICARRA Assunto: CONTAS ANUAIS DE GESTÃO Exercício: 2019 Ministério Público: Procuradora Sra. Maria Inez Klautau de Mendonça Gueiros Relator: Conselheira Mara Lúcia Barbalho da Cruz 14) Processo nº 007202.2021.2.000 Ordenador: Sr(a). JERIME REGO SOARES - CPF: 673.586.592-87 Origem: FUNDO MUNICIPAL DE SAUDE - ANAJAS Assunto: CONTAS ANUAIS DE GESTÃO Exercício: 2021 Ministério Público: Procuradora Sra. Maria Regina Franco Cunha Relator: Conselheiro Sebastião Cezar Leão Colares Advogado/Contador: WALDELICE SANTOS BRITO - CONTADOR - CRC 1420 15) Processo nº 066204.2023.2.000 Ordenador: Sr(a). MADALENA BRANDAO GOMES - CPF: 372.717.252-53 Origem: FUNDO MUNICIPAL DE ASSISTENCIA SOCIAL - SALVATERRA Assunto: CONTAS ANUAIS DE GESTÃO Exercício: 2023 Ministério Público: Procurador Sr. Marcelo Fonseca Barros Relator: Conselheiro Sebastião Cezar Leão Colares Advogado/Contador: CARLOS ALBERTO DE MORAES TORRES JUNIOR - CONTADOR - SSP 3744132 16) Processo nº 014462.2023.2.000 Ordenador: Sr(a). ALICKSON SERGIO LOPES DE SOUZA - CPF: 353.378.342-15, ARACELI MARIA PEREIRA LEMOS - CPF: 082.381.702-49, ROMULO LIMA DIAS - CPF: 815.746.902-30 Origem: ESCOLA BOSQUE PROF.EIDORFE MOREIRA - BELEM Assunto: CONTAS ANUAIS DE GESTÃO Exercício: 2023 Ministério Público: Procuradora Sra. Maria Inez Klautau de Mendonça Gueiros15 DOE TCMPA Nº 1.921 Terça-feira, 01 de abril de 2025 Consulta via leitora de QR Code/ Este Diário Oficial Eletrônico do TCMPA é GRATUITO e sua autenticidade poderá ser confirmada na página do Tribunal de Contas dos Municípios do Estado do Pará na Internet, no Endereço: diario-oficial-eletronico/ Relator: Conselheiro Sebastião Cezar Leão Colares Advogado/Contador: RITA DE CASSIA MESQUITA DAS MERCES - CONTADOR - SEGUP 4777100 17) Processo nº 018314.2023.2.000 Ordenador: Sr(a). DORALICE CAMARA DE ALMEIDA - CPF: 234.531.252-15 Origem: IAP DE BREVES - BREVES Assunto: CONTAS ANUAIS DE GESTÃO Exercício: 2023 Ministério Público: Procurador Sr. Marcelo Fonseca Barros Relator: Conselheiro Sebastião Cezar Leão Colares Advogado/Contador: DANIEL CEZAR DIAS ALBIM - CONTADOR - PC/PA 4451643 18) Processo nº 009397.2018.2.000 Ordenador: Sr(a). JESSE SILVA DO ESPÍRITO SANTO - CPF: 934.797.002-68, SUZANA CARVALHO LOBAO - CPF: 048.576.23234 Origem: FUNDO MUNICIPAL DE SAUDE - AUGUSTO CORREA Assunto: CONTAS ANUAIS DE GESTÃO Exercício: 2018 Ministério Público: Procuradora Sra. Elisabeth Massoud Salame da Silva Relator: Conselheiro Antonio José Costa de Freitas Guimarães 19) Processo nº 017398.2017.2.000 Ordenador: Sr(a). MARIO RIBEIRO DA SILVA JUNIOR - CPF: 352.909.942-20 Origem: FUNDO MUNICIPAL DE SAUDE - BRAGANCA Assunto: CONTAS ANUAIS DE GESTÃO Exercício: 2017 Ministério Público: Procuradora Sra. Maria Regina Franco Cunha Relator: Conselheiro Antonio José Costa de Freitas Guimarães Advogado/Contador: MARIO RIBEIRO DA SILVA JUNIOR - ORDENADOR - 20) Processo nº 065216.2023.2.000 Ordenador: Sr(a). MARCIA BEATRIZ GOMES DA SILVA - CPF: 686.018.082-04 Origem: FUNDEB - SALINOPOLIS Assunto: CONTAS ANUAIS DE GESTÃO Exercício: 2023 Ministério Público: Procuradora Sra. Maria Inez Klautau de Mendonça Gueiros Relator: Conselheiro Antonio José Costa de Freitas Guimarães 21) Processo nº 087403.2023.2.000 Ordenador: Sr(a). GENIVAL FERNANDES DA SILVA - CPF: 791.961.521-68 Origem: FUNDEB - XINGUARA Assunto: CONTAS ANUAIS DE GESTÃO Exercício: 2023 Ministério Público: Procurador Sr. Marcelo Fonseca Barros Relator: Conselheiro Antonio José Costa de Freitas Guimarães 22) Processo nº 014549.2023.2.000 Ordenador: Sr(a). CHRISTIANE FERREIRA DA SILVA - CPF: 560.176.502-20, LEONARDO DE JESUS FARIAS DA SILVA - CPF: 761.386.312-34, SERGIO BRAZAO E SILVA - CPF: 197.707.232-15 Origem: SECRETARIA MUNICIPAL DE MEIO AMBIENTE - BELEM Assunto: CONTAS ANUAIS DE GESTÃO Exercício: 2023 Ministério Público: Procuradora Sra. Maria Regina Franco Cunha Relator: Conselheiro Antonio José Costa de Freitas Guimarães 23) Processo nº 007202.2015.2.000 Ordenador: Sr(a). MARINETE FERNANDES DOS SANTOS - CPF: 490.940.412-00 Origem: FUNDO MUNICIPAL DE SAUDE - ANAJAS Assunto: CONTAS ANUAIS DE GESTÃO Exercício: 2015 Ministério Público: Procuradora Sra. Maria Inez Klautau de Mendonça Gueiros Relator: Conselheira Ann Clélia de Barros Pontes 24) Processo nº 028221.2015.2.000 Ordenador: Sr(a). ADIVALDO BORGES DA SILVA - CPF: 397.227.752-00 Origem: FUNDO MUNICIPAL DE SAUDE - CURRALINHO Assunto: CONTAS ANUAIS DE GESTÃO Exercício: 2015 Ministério Público: Procuradora Sra. Erika Monique Paraense Serra Vasconcellos Relator: Conselheira Ann Clélia de Barros Pontes 25) Processo nº 028221.2016.2.000 Ordenador: Sr(a). ADIVALDO BORGES DA SILVA - CPF: 397.227.752-00 Origem: FUNDO MUNICIPAL DE SAUDE - CURRALINHO Assunto: CONTAS ANUAIS DE GESTÃO Exercício: 2016 Ministério Público: Procuradora Sra. Erika Monique Paraense Serra Vasconcellos Relator: Conselheira Ann Clélia de Barros Pontes 26) Processo nº 062411.2023.2.000 Ordenador: Sr(a). CELIA MORAIS DA SILVA - CPF: 399.224.212-91, MARIA JUCEMA FURTADO CAPELLESSO - CPF: 803.131.082-34, MARIA JUCEMA FURTADO CAPELLESSO - CPF: 803.131.082-34 Origem: FUNDO DO DIREITO DA CRIANÇA E DO ADOLESC - REDENCAO DO PARA Assunto: CONTAS ANUAIS DE GESTÃO Exercício: 2023 Ministério Público: Procuradora Sra. Elisabeth Massoud Salame da Silva Relator: Conselheira Ann Clélia de Barros Pontes Advogado/Contador: AUGUSTO CEZAR DE ALMEIDA VALENTE - CONTADOR - SSP/PA 9289225Terça-feira, 01 de abril de 2025 DOE TCMPA Nº 1.921 16 Consulta via leitora de QR Code/ Este Diário Oficial Eletrônico do TCMPA é GRATUITO e sua autenticidade poderá ser confirmada na página do Tribunal de Contas dos Municípios do Estado do Pará na Internet, no Endereço: diario-oficial-eletronico/ 27) Processo nº 063205.2023.2.000 Ordenador: Sr(a). EMILIA SOUZA CARVALHO - CPF: 328.357.28287 Origem: FDCA - RIO MARIA Assunto: CONTAS ANUAIS DE GESTÃO Exercício: 2023 Ministério Público: Procuradora Sra. Erika Monique Paraense Serra Vasconcellos Relator: Conselheira Ann Clélia de Barros Pontes Advogado/Contador: LOURIVAL JOSE MARREIRO DA COSTA - CONTADOR - PC GO 3578882 28) Processo nº 014462.2016.2.000 Ordenador: Sr(a). CAROL LOBATO REZENDE ALVES - CPF: 731.158.272-53 Origem: ESCOLA BOSQUE PROF.EIDORFE MOREIRA - BELEM Assunto: CONTAS ANUAIS DE GESTÃO Exercício: 2016 Ministério Público: Procuradora Sra. Erika Monique Paraense Serra Vasconcellos Relator: Conselheira Ann Clélia de Barros Pontes Advogado/Contador: PAULO NAZARENO CARDOSO DA SILVA - CONTADOR - SSP-PA 5477136 29) Processo nº 014462.2015.2.000 Ordenador: Sr(a). CAROL LOBATO REZENDE ALVES - CPF: 731.158.272-53, FERNANDO COSTA DE QUEIROZ - CPF: 285.039.454-87 Origem: ESCOLA BOSQUE PROF.EIDORFE MOREIRA - BELEM Assunto: CONTAS ANUAIS DE GESTÃO Exercício: 2015 Ministério Público: Procuradora Sra. Erika Monique Paraense Serra Vasconcellos Relator: Conselheira Ann Clélia de Barros Pontes Advogado/Contador: PAULO NAZARENO CARDOSO DA SILVA - CONTADOR - SSP-PA 5477136 30) Processo nº 028212.2015.2.000 Ordenador: Sr(a). ROSIVALDO BORGES PANTOJA - CPF: 623.810.322-15 Origem: IAPSM DE CURRALINHO - CURRALINHO Assunto: CONTAS ANUAIS DE GESTÃO Exercício: 2015 Ministério Público: Procuradora Sra. Erika Monique Paraense Serra Vasconcellos Relator: Conselheira Ann Clélia de Barros Pontes 31) Processo nº 028217.2015.2.000 Ordenador: Sr(a). MARCOS BARATINHA OLIVEIRA - CPF: 577.098.232-20 Origem: SEC MUN DE EDUCACAO E DO DESPORTO - CURRALINHO Assunto: CONTAS ANUAIS DE GESTÃO Exercício: 2015 Ministério Público: Procuradora Sra. Erika Monique Paraense Serra Vasconcellos Relator: Conselheira Ann Clélia de Barros Pontes Advogado/Contador: MARCELO JONATHAN DA SILVA CORREA - CONTADOR - PC 2541509 32) Processo nº 201903533-00 Ordenador/Responsável: Sr(a). FERNANDO ALBERTO CABRAL DA CRUZ - CPF: 123.709.592-15 Origem: PREFEITURA MUNICIPAL DE CURUCA - CURUCA Assunto: RECURSO ORDINÁRIO Exercício: 2012 Ministério Público: Procuradora Sra. Maria Regina Franco Cunha Relator: Conselheiro José Carlos Araújo 33) Processo nº 1.018330.2016.2.0001 Ordenador/Responsável: Sr(a). BENEDITA AUXILIADORA CIRINO DA SILVA - CPF: 353.354.592-04 Origem: FUNDEB - BREVES Assunto: RECURSO ORDINÁRIO Exercício: 2016 Ministério Público: Procuradora Sra. Erika Monique Paraense Serra Vasconcellos Relator: Conselheiro José Carlos Araújo 34) Processo nº 1.067279.2017.2.0000 Ordenador/Responsável: Sr(a). BRENDA CAROLINA RODRIGUES DE ALBUQUERQUE PORTAL - CPF: 936.274.592-53 Origem: SEC MUN DE PROMOCAO E ASSISTENCIA SOCIAL - SANTA CRUZ DO ARARI Assunto: RECURSO ORDINÁRIO Exercício: 2017 Ministério Público: Procuradora Sra. Maria Inez Klautau de Mendonça Gueiros Relator: Conselheiro José Carlos Araújo 35) Processo nº 201514989-00 Ordenador/Responsável: Sr(a). ROSELITO SOARES DA SILVA - CPF: 299.518.601-68 Origem: PREFEITURA MUNICIPAL DE ITAITUBA - ITAITUBA Assunto: RECURSO ORDINÁRIO Exercício: 2008 Ministério Público: Procuradora Sra. Elisabeth Massoud Salame da Silva Relator: Conselheira Mara Lúcia Barbalho da Cruz 36) Processo nº 1.020201.2020.2.0030 Ordenador/Responsável: Sr(a). VANIA MARIA FIGUEIREDO CABRAL - CPF: 222.877.102-30 Origem: IAPSM (CACHOEIRA DO ARARI) - CACHOEIRA DO ARARI Assunto: RECURSO ORDINÁRIO Exercício: 2020 Ministério Público: Procuradora Sra. Erika Monique Paraense Serra Vasconcellos Relator: Conselheiro Antonio José Costa de Freitas Guimarães17 DOE TCMPA Nº 1.921 Terça-feira, 01 de abril de 2025 Consulta via leitora de QR Code/ Este Diário Oficial Eletrônico do TCMPA é GRATUITO e sua autenticidade poderá ser confirmada na página do Tribunal de Contas dos Municípios do Estado do Pará na Internet, no Endereço: diario-oficial-eletronico/ 37) Processo nº 1.005002.2018.2.0009 Ordenador/Responsável: Sr(a). BRUNO DENIEL BRILHANTE DOS SANTOS - CPF: 742.827.432-04 Origem: CÂMARA MUNICIPAL DE ALMEIRIM - ALMEIRIM Assunto: PEDIDO DE REVISÃO Exercício: 2018 Ministério Público: Procurador Sr. Marcelo Fonseca Barros Relator: Conselheiro Luis Daniel Lavareda Reis Junior Advogado/Contador: RAFAEL BENTES CORRÊA - ADVOGADO - OAB/PA 16514 38) Processo nº 201905790-00 Ordenador/Responsável: Sr(a). ALVARO BRITO XAVIER - CPF: 089.105.453-72 Origem: PREFEITURA MUNICIPAL DE CONCEIÇÃO DO ARAGUAIA - CONCEIÇÃO DO ARAGUAIA Assunto: PEDIDO DE REVISÃO Exercício: 2006 Ministério Público: Procuradora Sra. Erika Monique Paraense Serra Vasconcellos Relator: Conselheiro Lúcio Dutra Vale 39) Processo nº 201512542-00 Ordenador/Responsável: Sr(a). RAIMUNDO MARTINS CUNHA - CPF: 014.212.202-53 Origem: PREFEITURA MUNICIPAL DE MUANÁ - MUANÁ Assunto: PEDIDO DE REVISÃO Exercício: 2007 Ministério Público: Procuradora Sra. Maria Regina Franco Cunha Relator: Conselheiro Lúcio Dutra Vale 40) Processo nº 202000489-00 Ordenador/Responsável: Sr(a). MADALENA HOFFMAN - CPF: 802.740.051-15 Origem: PREFEITURA MUNICIPAL DE NOVO PROGRESSO - NOVO PROGRESSO Assunto: PEDIDO DE REVISÃO Exercício: 2010 Ministério Público: Procuradora Sra. Erika Monique Paraense Serra Vasconcellos Relator: Conselheiro Lúcio Dutra Vale 41) Processo nº 202003560-00 Ordenador/Responsável: Sr(a). LIDUINA MARIA AARTS DE FARIAS - CPF: 131.110.602-25 Origem: FUNDO MUNICIPAL DE ASSISTÊNCIA SOCIAL - BAIÃO Assunto: PEDIDO DE REVISÃO Exercício: 2009 Ministério Público: Procuradora Sra. Maria Inez Klautau de Mendonça Gueiros Relator: Conselheiro Lúcio Dutra Vale 42) Processo nº 201600349-00 Ordenador/Responsável: Sr(a). JOSE AUGUSTO PONTES MORAES - CPF: 000.479.532-68 Origem: ASSOC. COMUNIT. DO BAIRRO DO GUAMÁ - CENTRO COMUNITÁRIO - BELÉM Assunto: PEDIDO DE REVISÃO Exercício: 2009 Ministério Público: Procuradora Sra. Erika Monique Paraense Serra Vasconcellos Relator: Conselheiro Lúcio Dutra Vale 43) Processo nº 201907322-00 Ordenador/Responsável: Sr(a). SANDRA TEREZA DOS SANTOS BEZERRA - CPF: 212.435.302-00 Origem: SEC MUN DE EDUCACAO - CURUCA Assunto: PEDIDO DE REVISÃO Exercício: 2012 Ministério Público: Procuradora Sra. Erika Monique Paraense Serra Vasconcellos Relator: Conselheiro Lúcio Dutra Vale 44) Processo nº 1.019001.2010.2.0046 Ordenador/Responsável: Sr(a). LÚCIO ANTÔNIO FARO BITENCOURT - CPF: 331.580.962-34 Origem: PREFEITURA MUNICIPAL DE BUJARU - BUJARU Assunto: PEDIDO DE REVISÃO Exercício: 2010 Ministério Público: Procuradora Sra. Erika Monique Paraense Serra Vasconcellos Relator: Conselheira Ann Clélia de Barros Pontes 45) Processo nº 1.067001.2019.1.0010 Ordenador/Responsável: Sr(a). ANTONIO MARIA BARROS DE ALMEIDA - CPF: 301.745.112-72 Origem: PREFEITURA MUNICIPAL DE SANTA CRUZ DO ARARI - SANTA CRUZ DO ARARI Assunto: REPUBLICAÇÃO DE ATO Exercício: 2019 Ministério Público: Procuradora Sra. Elisabeth Massoud Salame da Silva Relator: Conselheiro Luis Daniel Lavareda Reis Junior 46) Processo nº 1.135204.2021.2.0005 Ordenador/Responsável: Sr(a). MARINALDO DE SIQUEIRA DOS SANTOS - CPF: 686.272.892-04 Origem: SEC. MUNICIPAL DE EDUCACAO E DESPORTO - CURUA Assunto: REPUBLICAÇÃO DE ATO Exercício: 2021 Ministério Público: Sem Representante MP Relator: Conselheiro Luis Daniel Lavareda Reis Junior Advogado/Contador: ROOSEVELT JOSE DA SILVA SOUSA - CONTADOR - CRC/PA 10401Terça-feira, 01 de abril de 2025 DOE TCMPA Nº 1.921 18 Consulta via leitora de QR Code/ Este Diário Oficial Eletrônico do TCMPA é GRATUITO e sua autenticidade poderá ser confirmada na página do Tribunal de Contas dos Municípios do Estado do Pará na Internet, no Endereço: diario-oficial-eletronico/ 47) Processo nº 1.028212.2019.2.0022 Ordenador/Responsável: Sr(a). VALDOMIRO ANDRADE DE SALES - CPF: 096.910.222-49 Origem: IAPSM DE CURRALINHO - CURRALINHO Assunto: REPUBLICAÇÃO DE ATO Exercício: 2019 Ministério Público: Procuradora Sra. Erika Monique Paraense Serra Vasconcellos Relator: Conselheiro Luis Daniel Lavareda Reis Junior 48) Processo nº 019001.2018.1.000 Ordenador/Responsável: Sr(a). JORGE SATO - CPF: 354.571.47215 Origem: PREFEITURA MUNICIPAL DE BUJARU - BUJARU Assunto: REPUBLICAÇÃO DE ATO Exercício: 2018 Ministério Público: Procurador Sr. Marcelo Fonseca Barros Relator: Conselheiro Lúcio Dutra Vale Advogado/Contador: CARLOS VITTOR DE ANDRADE MONTEIRO - CONTADOR - CRC 15565 Secretaria-Geral do Tribunal de Contas dos Municípios do Estado do Pará, em 31/03/2025. JORGE ANTONIO CAJANGO PEREIRA Secretário-Geral Protocolo: 52562 DO GABINETE DO CORREGEDOR SOLICITAÇÃO DE PARCELAMENTO CONS. CEZAR COLARES DESPACHO DE SOLICITAÇÃO DE PARCELAMENTO Nº 051/2025 PROCESSO N°: 1.028229.2017.2.0002",
  "gestora": "Prefeitura Municipal Exercício: 2023",
  "interessado(s)": "Fredson Pereira da Silva CPF Nº 650.021.212-68",
  "instrução": "1ª Controladoria",
  "relatora": "Conselheira Ann Pontes EMENTA: PRESTAÇÃO DE CONTAS ANUAIS DO CHEFE DO PODER EXECUTIVO. PREFEITURA MUNICIPAL DE PAU D’ARCO. EXERCÍCIO 2023. 1. AO FINAL DA INSTRUÇÃO PROCESSUAL RESTARAM A SEGUINTES FALHAS. 1) FALHAS FORMAIS DETECTADAS NOS PROCESSOS LICITATÓRIOS, 2) DESCUMPRIMENTO DA LEI DE ACESSO À INFORMAÇÃO, COM ATENDIMENTO DE 94,19% DAS OBRIGAÇÕES CONTIDAS NA MATRIZ ÚNICA DE ATENDIMENTO, CONFORME O RELATÓRIO TÉCNICO DE DIAGNÓSTICO DE ATENDIMENTO DESSA MATRIZ ÚNICA DA TRANSPARÊNCIA PÚBLICA MUNICIPAL, 3) INCORRETO EMPENHO E RECOLHIMENTO DAS OBRIGAÇÕES PATRONAIS. ESSAS FALHAS NÃO COMPROMETEM A REGULARIDADE DAS CONTAS, MAS SUJEITA O ORDENADOR À APLICAÇÃO DE MULTAS. 2. VOTAM PELA EMISSÃO DE PARECER PRÉVIO PELA REGULARIDADE COM RESSALVAS DAS CONTAS. MULTAS AO FUMREAP. RECOLHIMENTOS AO ERÁRIO MUNICIPAL. RESOLVEM os Conselheiros do Tribunal de Contas dos Municípios do Estado do Pará, por votação unânime, em conformidade com a ata da sessão e nos termos do relatório e voto da Conselheira Relatora: DECISÃO: I. VOTAM, nos termos do inciso II, do art. 45 da Lei Complementar Estadual nº. 109/2016, pela emissão de Parecer Prévio, recomendando à Câmara Municipal de Pau D’Arco, a APROVAÇÃO, COM RESSALVAS, das Contas Anuais da Prefeitura Municipal, referente ao exercício financeiro de 2023, de responsabilidade do Sr. Fredson Pereira da Silva. II. DEVE o Ordenador recolher, a título de multas, os seguintes valores: A) Ao FUMREAP/TCM/PA, instituído pela Lei nº. 7.368/2.009, de 29/12/2.009, no prazo de 30 (trinta) dias, conforme previsão do art. 695, caput, do RI/TCM-PA: 1) 1.000 UPF-PA, com fundamento no artigo 698, inciso IV, alínea “b”, do RI/TCM/PA, pelas falhas formais detectadas nos processos licitatórios, descumprindo a IN Nº 022/2021-TCM/PA c/c Lei nº 8.666/93; 2) 200 UPF-PA, com fundamento no artigo 698, inciso IV, alínea “b”, do RI/TCM/PA, pelo descumprimento da Lei de Acesso à Informação, com atendimento de 94,19% das obrigações contidas na Matriz Única de atendimento, conforme o Relatório Técnico de Diagnóstico de Atendimento dessa Matriz Única da Transparência Pública Municipal. B) Ao ERÁRIO MUNICIPAL, nos termos do art. 712, inciso I, e parágrafo único, do RI/ TCM/PA, no prazo de 30 (trinta) dias, a contar do trânsito em julgado da decisão, nos termos do art. 714, do mesmo diploma legal: 1) 500 UPF-PA, com fundamento no art. 698, inciso IV, alínea “b”, do RI/TCM/PA, pelo incorreto empenho e recolhimento das Obrigações Patronais, no montante de R$-395.919,41 (trezentos e noventa e cinco mil, novecentos e dezenove reais e quarenta e um centavos), descumprindo o disposto no art. 195, inciso I, alínea “a”, da Constituição Federal; nos arts. 15, inciso I; 22, incisos I, II e 30, inciso I, alíneas “a” e “b”, da Lei nº 8.212/91; no art. 35 da Lei Federal nº. 4.320/64 c/c o art. 50, inciso II, da Lei de Responsabilidade Fiscal.13 DOE TCMPA Nº 1.921 Terça-feira, 01 de abril de 2025 Consulta via leitora de QR Code/ Este Diário Oficial Eletrônico do TCMPA é GRATUITO e sua autenticidade poderá ser confirmada na página do Tribunal de Contas dos Municípios do Estado do Pará na Internet, no Endereço: diario-oficial-eletronico/ III. Fique desde já CIENTE o Ordenador que o não recolhimento das multas aplicadas, na forma e nos prazos fixados, após o trânsito em julgado da presente decisão, resultará nos acréscimos decorrentes de mora, nos termos do art. 703, incisos I a III, do RI/TCM/PA e, ainda, no caso de não atendimento de referidas determinações, fica à Secretaria-Geral/TCM/PA autorizada a proceder com os trâmites necessários para o efetivo protesto e execução do título, na forma regimental. IV. Por fim, após o trânsito em julgado desta decisão, que a Secretaria-Geral proceda o encaminhamento das prestações de contas, de forma eletrônica, ao(a) Presidente da Câmara Municipal de Floresta do Araguaia, para que este(a) promova o processamento e julgamento deste Parecer Prévio, no prazo de 90 (noventa) dias, conforme determina o art. 71, §2º, da Constituição Estadual, bem como informe ao TCM/PA o resultado do julgamento, sob pena de envio dos autos ao Ministério Público para apuração do crime de improbidade, por violação do art.11, inciso II, da Lei nº 8.429/92, sem prejuízo de outras sanções que vier imputar o Tribunal, seja de natureza pecuniária, seja de ponto de controle para fins de reprovação das Contas Anuais. Sessão do Pleno do Tribunal de Contas dos Municípios do Estado do Pará em 18 de março de 2025. Download Anexo - Relatório e Voto do Relator Protocolo: 52558 DO GABINETE DA PRESIDÊNCIA PAUTA DE JULGAMENTO CONS. LÚCIO VALE O Secretário-Geral do Tribunal de Contas dos Municípios do Estado do Pará, comunica aos interessados que o Egrégio Plenário desta Corte julgará, na Sessão do Plenário Virtual (Eletrônico) Pleno, a ser realizada no período de 07/04/2025 a 11/04/2025, os seguintes processos: 01) Processo nº 132001.2020.1.000",
  "ordenador": "Sr(a). JOCICLELIO CASTRO MACEDO - CPF: [REDIGIDO]",
  "origem": "PREFEITURA MUNICIPAL DE BELTERRA - BELTERRA Assunto: CONTAS ANUAIS CHEFE DO EXECUTIVO Exercício: 2020 Ministério",
  "público": "Procuradora Sra. Elisabeth Massoud Salame da Silva Relator: Conselheiro José Carlos Araújo Advogado/",
  "procedência": "FUNDO MUNICIPAL DE ASSISTÊNCIA SOCIAL MUNICÍPIO: CURRALINHO",
  "interessado": "THAIS MONIK LERAY DA SILVA CPF: [REDIGIDO] EXERCÍCIO: 2017 ASSUNTO: SOLICITAÇÃO DE PARCELAMENTO DE MULTA AO FUMREAP, REFERENTE A PRESTAÇÃO DE CONTAS CONSTANTE NO PROCESSO Nº 028229.2017.2.000,",
  "sample_texto": "ACÓRDÃO Nº 46.875 PROCESSO Nº 018338.2023.2.000 MUNICÍPIO: BREVES ÓRGÃO: FUNDO MUNICIPAL DE ASSISTÊN...",
  "ioepa": "https://tcm.ioepa.com.br/diarios/2025/2025.04.01.DOE.pdf",
  "local": {
    "caminho": "/home/joaompessoa/diario_oficial_tcmpa/diarios/2025/04/2025.04.01.DOE.pdf",
    "pdf": "2025.04.01.DOE.pdf"
  },
  "texto_original": "ACÓRDÃO Nº 46.875 PROCESSO Nº 018338.2023.2.000 MUNICÍPIO: BREVES ÓRGÃO: FUNDO MUNICIPAL DE ASSISTÊNCIA SOCIAL – FMAS ASSUNTO: CONTAS ANUAIS DE GESTÃO EXERCÍCIO: 2023 ORDENADORA: JOSELICE CARAMES DE MELO – CPF Nº 643.295.182-87 CONTADORES: FÁBIO PANTOJA DE SOUZA – CRC/PA Nº 11.233 PAULO SÉRGIO FADUL NEVES – CRC/PA Nº 8.812 MPC: PROCURADORA ELISABETH MASSOUD SALAME DA SILVA RELATOR: CONSELHEIRO SEBASTIÃO CEZAR LEÃO COLARES EMENTA. Contas Anuais de Gestão. Remessa dos arquivos contábeis e de folha de pagamento fora do prazo. Contas Regulares com Ressalvas. Alvará de Quitação. Vistos, relatados e discutidos os autos, ACORDAM os Conselheiros do Tribunal de Contas dos Municípios do Estado do Pará, por votação unânime, conforme ata da SESSÃO DO PLENO, realizada nesta data, e nos termos do Relatório e Voto do Conselheiro Relator, DECISÃO: I – JULGAR REGULARES COM RESSALVAS, com fundamento no art. 45, II, da Lei Complementar nº 109/2016, as contas do FUNDO MUNICIPAL DE ASSISTÊNCIA SOCIAL DE BREVES, exercício financeiro de 2023, de responsabilidades de JOSELICE CARAMES DE MELO; II – APLICAR MULTA na quantidade de 200 (duzentas) UPF/PA – Unidades de Padrão Fiscal do Estado do Pará, prevista no inciso I do art. 700 do Regimento Interno deste Tribunal, pela remessa intempestiva dos arquivos contábeis dos meses de janeiro e fevereiro, e dos arquivos de folha de pagamento dos meses de janeiro, fevereiro e março, descumprindo o art. 6º inciso I da Instrução Normativa nº 002/2019/TCM/PA; III – ADVERTIR a Ordenadora, que em caso de não recolhimento da multa no prazo estipulado, ficará passível dos acréscimos decorrentes da mora, com base no art. 703, I, II, III, do RI/TCM-PA; IV – EXPEDIR o competente Alvará de Quitação à Ordenadora, pelas despesas ordenadas, no montante de R$-11.681.842,46 (onze milhões e seiscentos e oitenta e um mil e oitocentos e quarenta e dois reais e quarenta e seis centavos), onde se inclui o valor de R$-526.043,58 (quinhentos e vinte e seis mil e quarenta e três reais e cinquenta e oito centavos) de saldo em bancos para o exercício seguinte, condicionado a comprovação do recolhimento da multa aplicada. Sessão do Pleno do Tribunal de Contas dos Municípios do Estado do Pará, 20 de março de 2025. Protocolo: 52558 Download Anexo - Relatório e Voto do Relator  RESOLUÇÃO RESOLUÇÃO Nº 17.162/2025 Processo nº 202001389-00 (PC 490012014-00) Município: Muaná Exercício: 2014 Assunto: Recurso Ordinário Decisão Recorrida: Resolução nº 15.208, de 28/01/2020, que emitiu Parecer Prévio Contrário à Aprovação da Prestação de Contas de Governo Responsável: Sérgio Murilo dos Santos Guimarães – CPF: 451.024.652-87 Advogado: Sem Advogado Constituído Relator: Conselheiro Luis Daniel Lavareda Reis Junior Membro/MPCM: Erika Monique Paraense EMENTA: RECURSO ORDINÁRIO. PRESTAÇÃO DE CONTAS ANUAIS DE GOVERNO. MUNICÍPIO DE MUANÁ. EXERCÍCIO 2014. PELO CONHECIMENTO. PROVIMENTO PARCIAL DO RECURSO. AFASTAR A FALHA PELO DESCUMPRIMENTO AO ART. 60, IV, DO ADCT. MANTIDA A DECISÃO CONTIDA NA RESOLUÇÃO Nº 15.208/2020 QUE EMITIU PARECER PRÉVIO RECOMENDANDO AO LEGISLATIVO MUNICIPAL A NÃO APROVAÇÃO DAS CONTAS. UNANIMIDADE. MANUTENÇÃO DA MULTA APLICADA. Vistos, relatados e discutidos os autos que tratam do Recurso Ordinário impetrado pelo Sr. Sérgio Murilo dos Santos Guimarães, ex-prefeito do município de Muaná, exercício 2014, contra decisão contida na Resolução nº 15.208/2020, que emitiu parecer prévio pela irregularidade das contas, Resolvem os Conselheiros do Tribunal de Contas dos Municípios do Estado do Pará, nos termos da Ata da sessão e do Relatório e Voto do Conselheiro Relator, por unanimidade, DECISÃO: Pelo CONHECIMENTO, e no mérito, pelo PROVIMENTO PARCIAL do Recurso interposto, para afastar a falha pelo descumprimento ao art. 60, IV, do ADCT e art. 11 da Lei nº 11.494/2007, mantendo-se os termos da Resolução nº\nTerça-feira, 01 de abril de 2025 DOE TCMPA Nº 1.921 12    Consulta via leitora de QR Code/ Este Diário Oficial Eletrônico do TCMPA é GRATUITO e sua autenticidade poderá ser confirmada na página do Tribunal de Contas dos Municípios do Estado do Pará na Internet, no Endereço: diario-oficial-eletronico/ 15.208/2020-TCM/PA, pela emissão de Parecer Prévio contrário a aprovação das Contas de Governo da Prefeitura Municipal de Muaná, exercício de 2014, pelo descumprimento ao art. 20, III, “b” e art. 19, III, da Lei de Responsabilidade Fiscal, com a manutenção das multas fixadas. Sessão Plenária Ordinária do Tribunal de Contas dos Municípios do Estado do Pará, em 23/01/2025. Download Anexo - Relatório e Voto do Relator  RESOLUÇÃO Nº 17.207 PROCESSO E-TCM: 1.093276.2018.2.0003 - (SPE Nº 093276.2018.2.000) MUNICÍPIO: GARRAFÃO DO NORTE ÓRGÃO: FUNDO MUNICIPAL DE SAÚDE EXERCÍCIO: 2018 ASSUNTO: CONTAS ANUAIS DE GESTÃO REABERTURA DE INSTRUÇÃO PROCESSUAL RESPONSÁVEL: FRANCISCO MARCOLINO DE ALMEIDA – CPF: 728.078.812-20 CONTADOR: IBRAN DOS SANTOS NOVAES MPC: PROCURADORA MARIA INEZ KLAUTAU DE MENDONÇA GUEIROS RELATOR: CONSELHEIRO SEBASTIÃO CEZAR LEÃO COLARES EMENTA: Contas Anuais de Gestão. Reabertura de Instrução Processual. Vistos, relatados e discutidos os autos, RESOLVEM os Conselheiros do Tribunal de Contas dos Municípios do Estado do Pará, por votação unânime, conforme ata da SESSÃO PLENÁRIA ELETRÔNICA VIRTUAL, realizada no período de 10/03/2025 a 14/03/2025, e nos termos do Relatório do Conselheiro Relator, DECISÃO: REABRIR A INSTRUÇÃO PROCESSUAL das CONTAS ANUAIS DE GESTÃO do FUNDO MUNICIPAL DE SAÚDE DE GARRAFÃO DO NORTE, exercício financeiro de 2018, de responsabilidade de FRANCISCO MARCOLINO DE ALMEIDA, para análise de nova documentação (memorial descritivo), recebida através do processo nº 1.093276.2018.2.0002. Sessão Plenária Eletrônica Virtual do Tribunal de Contas dos Municípios do Estado do Pará, de 10 a 14 de março de 2025. Download Anexo - Relatório e Voto do Relator  RESOLUÇÃO Nº 17.209 Processo nº 121001.2023.1.000 Município: Pau D’Arco Unidade Gestora: Prefeitura Municipal Exercício: 2023 Interessado(s): Fredson Pereira da Silva CPF Nº 650.021.212-68 Instrução: 1ª Controladoria Assunto: Prestação de Contas Anuais Chefe do Executivo MPCM/PA: Procuradora Elisabeth Massoud Salame da Silva Relatora: Conselheira Ann Pontes EMENTA: PRESTAÇÃO DE CONTAS ANUAIS DO CHEFE DO PODER EXECUTIVO. PREFEITURA MUNICIPAL DE PAU D’ARCO. EXERCÍCIO 2023. 1. AO FINAL DA INSTRUÇÃO PROCESSUAL RESTARAM A SEGUINTES FALHAS. 1) FALHAS FORMAIS DETECTADAS NOS PROCESSOS LICITATÓRIOS, 2) DESCUMPRIMENTO DA LEI DE ACESSO À INFORMAÇÃO, COM ATENDIMENTO DE 94,19% DAS OBRIGAÇÕES CONTIDAS NA MATRIZ ÚNICA DE ATENDIMENTO, CONFORME O RELATÓRIO TÉCNICO DE DIAGNÓSTICO DE ATENDIMENTO DESSA MATRIZ ÚNICA DA TRANSPARÊNCIA PÚBLICA MUNICIPAL, 3) INCORRETO EMPENHO E RECOLHIMENTO DAS OBRIGAÇÕES PATRONAIS. ESSAS FALHAS NÃO COMPROMETEM A REGULARIDADE DAS CONTAS, MAS SUJEITA O ORDENADOR À APLICAÇÃO DE MULTAS. 2. VOTAM PELA EMISSÃO DE PARECER PRÉVIO PELA REGULARIDADE COM RESSALVAS DAS CONTAS. MULTAS AO FUMREAP. RECOLHIMENTOS AO ERÁRIO MUNICIPAL. RESOLVEM os Conselheiros do Tribunal de Contas dos Municípios do Estado do Pará, por votação unânime, em conformidade com a ata da sessão e nos termos do relatório e voto da Conselheira Relatora: DECISÃO: I. VOTAM, nos termos do inciso II, do art. 45 da Lei Complementar Estadual nº. 109/2016, pela emissão de Parecer Prévio, recomendando à Câmara Municipal de Pau D’Arco, a APROVAÇÃO, COM RESSALVAS, das Contas Anuais da Prefeitura Municipal, referente ao exercício financeiro de 2023, de responsabilidade do Sr. Fredson Pereira da Silva. II. DEVE o Ordenador recolher, a título de multas, os seguintes valores: A) Ao FUMREAP/TCM/PA, instituído pela Lei nº. 7.368/2.009, de 29/12/2.009, no prazo de 30 (trinta) dias, conforme previsão do art. 695, caput, do RI/TCM-PA: 1) 1.000 UPF-PA, com fundamento no artigo 698, inciso IV, alínea “b”, do RI/TCM/PA, pelas falhas formais detectadas nos processos licitatórios, descumprindo a IN Nº 022/2021-TCM/PA c/c Lei nº 8.666/93; 2) 200 UPF-PA, com fundamento no artigo 698, inciso IV, alínea “b”, do RI/TCM/PA, pelo descumprimento da Lei de Acesso à Informação, com atendimento de 94,19% das obrigações contidas na Matriz Única de atendimento, conforme o Relatório Técnico de Diagnóstico de Atendimento dessa Matriz Única da Transparência Pública Municipal. B) Ao ERÁRIO MUNICIPAL, nos termos do art. 712, inciso I, e parágrafo único, do RI/ TCM/PA, no prazo de 30 (trinta) dias, a contar do trânsito em julgado da decisão, nos termos do art. 714, do mesmo diploma legal: 1) 500 UPF-PA, com fundamento no art. 698, inciso IV, alínea “b”, do RI/TCM/PA, pelo incorreto empenho e recolhimento das Obrigações Patronais, no montante de R$-395.919,41 (trezentos e noventa e cinco mil, novecentos e dezenove reais e quarenta e um centavos), descumprindo o disposto no art. 195, inciso I, alínea “a”, da Constituição Federal; nos arts. 15, inciso I; 22, incisos I, II e 30, inciso I, alíneas “a” e “b”, da Lei nº 8.212/91; no art. 35 da Lei Federal nº. 4.320/64 c/c o art. 50, inciso II, da Lei de Responsabilidade Fiscal.\n13 DOE TCMPA Nº 1.921 Terça-feira, 01 de abril de 2025    Consulta via leitora de QR Code/ Este Diário Oficial Eletrônico do TCMPA é GRATUITO e sua autenticidade poderá ser confirmada na página do Tribunal de Contas dos Municípios do Estado do Pará na Internet, no Endereço: diario-oficial-eletronico/ III. Fique desde já CIENTE o Ordenador que o não recolhimento das multas aplicadas, na forma e nos prazos fixados, após o trânsito em julgado da presente decisão, resultará nos acréscimos decorrentes de mora, nos termos do art. 703, incisos I a III, do RI/TCM/PA e, ainda, no caso de não atendimento de referidas determinações, fica à Secretaria-Geral/TCM/PA autorizada a proceder com os trâmites necessários para o efetivo protesto e execução do título, na forma regimental. IV. Por fim, após o trânsito em julgado desta decisão, que a Secretaria-Geral proceda o encaminhamento das prestações de contas, de forma eletrônica, ao(a) Presidente da Câmara Municipal de Floresta do Araguaia, para que este(a) promova o processamento e julgamento deste Parecer Prévio, no prazo de 90 (noventa) dias, conforme determina o art. 71, §2º, da Constituição Estadual, bem como informe ao TCM/PA o resultado do julgamento, sob pena de envio dos autos ao Ministério Público para apuração do crime de improbidade, por violação do art.11, inciso II, da Lei nº 8.429/92, sem prejuízo de outras sanções que vier imputar o Tribunal, seja de natureza pecuniária, seja de ponto de controle para fins de reprovação das Contas Anuais. Sessão do Pleno do Tribunal de Contas dos Municípios do Estado do Pará em 18 de março de 2025. Download Anexo - Relatório e Voto do Relator Protocolo: 52558  DO GABINETE DA PRESIDÊNCIA PAUTA DE JULGAMENTO CONS. LÚCIO VALE O Secretário-Geral do Tribunal de Contas dos Municípios do Estado do Pará, comunica aos interessados que o Egrégio Plenário desta Corte julgará, na Sessão do Plenário Virtual (Eletrônico) Pleno, a ser realizada no período de 07/04/2025 a 11/04/2025, os seguintes processos:  01) Processo nº 132001.2020.1.000 Ordenador: Sr(a). JOCICLELIO CASTRO MACEDO - CPF: 559.991.582-49 Origem: PREFEITURA MUNICIPAL DE BELTERRA - BELTERRA Assunto: CONTAS ANUAIS CHEFE DO EXECUTIVO Exercício: 2020 Ministério Público: Procuradora Sra. Elisabeth Massoud Salame da Silva Relator: Conselheiro José Carlos Araújo Advogado/Contador: Roosevelt José da Silva Sousa - Contador - SRF 32441142291  02) Processo nº 003001.2019.1.000 Ordenador: Sr(a). ODIMAR WANDERLEY SALOMAO - CPF: 226.543.642-91 Origem: PREFEITURA MUNICIPAL DE AFUA - AFUA Assunto: CONTAS ANUAIS CHEFE DO EXECUTIVO Exercício: 2019 Ministério Público: Procurador Sr. Marcelo Fonseca Barros Relator: Conselheiro Luis Daniel Lavareda Reis Junior Advogado/Contador: RAIMUNDO EDSON DE AMORIM SANTOS - CONTADOR - SEGUP-PA 3785022  03) Processo nº 810012011-00 Ordenador: Sr(a). CLETO JOSÉ ALVES DA SILVA - CPF: 041.649.382-34 Origem: PREFEITURA MUNICIPAL DE SENADOR JOSE PORFIRIO - SENADOR JOSE PORFIRIO Assunto: CONTAS ANUAIS CHEFE DO EXECUTIVO Exercício: 2011 Ministério Público: Procuradora Sra. Maria Regina Franco Cunha Relator: Conselheira Mara Lúcia Barbalho da Cruz  04) Processo nº 810012012-00 Ordenador: Sr(a). CLETO JOSÉ ALVES DA SILVA - CPF: 041.649.382-34 Origem: PREFEITURA MUNICIPAL DE SENADOR JOSE PORFIRIO - SENADOR JOSE PORFIRIO Assunto: CONTAS ANUAIS DE GESTÃO Exercício: 2012 Ministério Público: Procuradora Sra. Elisabeth Massoud Salame da Silva Relator: Conselheira Mara Lúcia Barbalho da Cruz  05) Processo nº 043001.2017.1.000 Ordenador: Sr(a). RAIMUNDA DA COSTA ARAUJO - CPF: 038.817.762-49 Origem: PREFEITURA MUNICIPAL DE MARACANA - MARACANA Assunto: CONTAS ANUAIS CHEFE DO EXECUTIVO Exercício: 2017 Ministério Público: Procuradora Sra. Elisabeth Massoud Salame da Silva Relator: Conselheiro Antonio José Costa de Freitas Guimarães  06) Processo nº 061001.2020.1.000 Ordenador: Sr(a). ANA RENATA BRITO DE SOUSA - CPF: 665.578.602-91 Origem: PREFEITURA MUNICIPAL DE PRIMAVERA - PRIMAVERA Assunto: CONTAS ANUAIS CHEFE DO EXECUTIVO Exercício: 2020 Ministério Público: Procuradora Sra. Maria Regina Franco Cunha Relator: Conselheiro Antonio José Costa de Freitas Guimarães Advogado/Contador: ANA RENATA BRITO DE SOUSA - PREFEITO - ssp/pa 3042335  07) Processo nº 032006.2023.2.000 Ordenador: Sr(a). ALDECY VITOR DE OLIVEIRA JUNIOR - CPF: 621.387.232-91\nTerça-feira, 01 de abril de 2025 DOE TCMPA Nº 1.921 14    Consulta via leitora de QR Code/ Este Diário Oficial Eletrônico do TCMPA é GRATUITO e sua autenticidade poderá ser confirmada na página do Tribunal de Contas dos Municípios do Estado do Pará na Internet, no Endereço: diario-oficial-eletronico/ Origem: FUNDO MUNICIPAL DE EDUCACAO - IGARAPE-ACU Assunto: CONTAS ANUAIS DE GESTÃO Exercício: 2023 Ministério Público: Procuradora Sra. Erika Monique Paraense Serra Vasconcellos Relator: Conselheiro José Carlos Araújo Advogado/Contador: MARCUS PLINIO GARCIA DE LIMA - CONTADOR - SSP 2854493  08) Processo nº 056020.2023.2.000 Ordenador: Sr(a). LEISE VIEIRA DE MESQUITA - CPF: 843.683.81220 Origem: FUNDO MUN DE EDUCACAO - PEIXE-BOI Assunto: CONTAS ANUAIS DE GESTÃO Exercício: 2023 Ministério Público: Procuradora Sra. Erika Monique Paraense Serra Vasconcellos Relator: Conselheiro José Carlos Araújo Advogado/Contador: ROMULO VICTOR DE LIMA MELO - CONTADOR - CRC-PA 15562  09) Processo nº 061420.2023.2.000 Ordenador: Sr(a). PAULO HENRIQUE RIBEIRO DA COSTA - CPF: 023.095.702-14 Origem: FUNDO MUNICIPAL DE EDUCAÇÃO - FME - PRIMAVERA Assunto: CONTAS ANUAIS DE GESTÃO Exercício: 2023 Ministério Público: Procurador Sr. Marcelo Fonseca Barros Relator: Conselheiro José Carlos Araújo Advogado/Contador: VINICIUS NAZARENO GARCIA DE LIMA - CONTADOR - CRC-PA 14352  10) Processo nº 141010.2023.2.000 Ordenador: Sr(a). MAGALI SORAIA BARATA LIMA - CPF: 305.789.492-53 Origem: FUNDO MUNICIPAL DE EDUCACAO - QUATIPURU Assunto: CONTAS ANUAIS DE GESTÃO Exercício: 2023 Ministério Público: Procuradora Sra. Maria Regina Franco Cunha Relator: Conselheiro José Carlos Araújo Advogado/Contador: RANDSON ANDRE SILVA FERREIRA - CONTADOR - SSP 5897060  11) Processo nº 480032012-00 Ordenador: Sr(a). JARDEL VASCONCELOS CARMO - CPF: 033.916.122-15 Origem: FUNDO MUNIC. DE ASSISTENCIA SOCIAL - MONTE ALEGRE Assunto: CONTAS ANUAIS DE GESTÃO Exercício: 2012 Ministério Público: Procuradora Sra. Maria Inez Klautau de Mendonça Gueiros Relator: Conselheira Mara Lúcia Barbalho da Cruz 12) Processo nº 124447.2019.2.000  Ordenador: Sr(a). PEDRO PATRICIO DE MEDEIROS - CPF: 443.471.709-04, VICENTE ALVES CARDOSO - CPF: 429.829.442-00 Origem: FUNDO MUNICIPAL DE EDUCACAO - SAO DOMINGOS DO ARAGUAIA Assunto: CONTAS ANUAIS DE GESTÃO Exercício: 2019 Ministério Público: Procuradora Sra. Maria Regina Franco Cunha Relator: Conselheira Mara Lúcia Barbalho da Cruz Advogado/Contador: VICENTE ALVES CARDOSO - ORDENADOR - PC 2268567, PEDRO PATRICIO DE MEDEIROS - ORDENADOR - SSP/PA 31809959  13) Processo nº 139012.2019.2.000 Ordenador: Sr(a). LAANE BARROS LUCENA - CPF: 989.972.201-44 Origem: SECRETARIA MUNICIPAL DE EDUCACAO - PICARRA Assunto: CONTAS ANUAIS DE GESTÃO Exercício: 2019 Ministério Público: Procuradora Sra. Maria Inez Klautau de Mendonça Gueiros Relator: Conselheira Mara Lúcia Barbalho da Cruz  14) Processo nº 007202.2021.2.000 Ordenador: Sr(a). JERIME REGO SOARES - CPF: 673.586.592-87 Origem: FUNDO MUNICIPAL DE SAUDE - ANAJAS Assunto: CONTAS ANUAIS DE GESTÃO Exercício: 2021 Ministério Público: Procuradora Sra. Maria Regina Franco Cunha Relator: Conselheiro Sebastião Cezar Leão Colares Advogado/Contador: WALDELICE SANTOS BRITO - CONTADOR - CRC 1420  15) Processo nº 066204.2023.2.000 Ordenador: Sr(a). MADALENA BRANDAO GOMES - CPF: 372.717.252-53 Origem: FUNDO MUNICIPAL DE ASSISTENCIA SOCIAL - SALVATERRA Assunto: CONTAS ANUAIS DE GESTÃO Exercício: 2023 Ministério Público: Procurador Sr. Marcelo Fonseca Barros Relator: Conselheiro Sebastião Cezar Leão Colares Advogado/Contador: CARLOS ALBERTO DE MORAES TORRES JUNIOR - CONTADOR - SSP 3744132  16) Processo nº 014462.2023.2.000 Ordenador: Sr(a). ALICKSON SERGIO LOPES DE SOUZA - CPF: 353.378.342-15, ARACELI MARIA PEREIRA LEMOS - CPF: 082.381.702-49, ROMULO LIMA DIAS - CPF: 815.746.902-30 Origem: ESCOLA BOSQUE PROF.EIDORFE MOREIRA - BELEM Assunto: CONTAS ANUAIS DE GESTÃO Exercício: 2023 Ministério Público: Procuradora Sra. Maria Inez Klautau de Mendonça Gueiros\n15 DOE TCMPA Nº 1.921 Terça-feira, 01 de abril de 2025    Consulta via leitora de QR Code/ Este Diário Oficial Eletrônico do TCMPA é GRATUITO e sua autenticidade poderá ser confirmada na página do Tribunal de Contas dos Municípios do Estado do Pará na Internet, no Endereço: diario-oficial-eletronico/ Relator: Conselheiro Sebastião Cezar Leão Colares Advogado/Contador: RITA DE CASSIA MESQUITA DAS MERCES - CONTADOR - SEGUP 4777100  17) Processo nº 018314.2023.2.000 Ordenador: Sr(a). DORALICE CAMARA DE ALMEIDA - CPF: 234.531.252-15 Origem: IAP DE BREVES - BREVES Assunto: CONTAS ANUAIS DE GESTÃO Exercício: 2023 Ministério Público: Procurador Sr. Marcelo Fonseca Barros Relator: Conselheiro Sebastião Cezar Leão Colares Advogado/Contador: DANIEL CEZAR DIAS ALBIM - CONTADOR - PC/PA 4451643  18) Processo nº 009397.2018.2.000 Ordenador: Sr(a). JESSE SILVA DO ESPÍRITO SANTO - CPF: 934.797.002-68, SUZANA CARVALHO LOBAO - CPF: 048.576.23234 Origem: FUNDO MUNICIPAL DE SAUDE - AUGUSTO CORREA Assunto: CONTAS ANUAIS DE GESTÃO Exercício: 2018 Ministério Público: Procuradora Sra. Elisabeth Massoud Salame da Silva Relator: Conselheiro Antonio José Costa de Freitas Guimarães  19) Processo nº 017398.2017.2.000 Ordenador: Sr(a). MARIO RIBEIRO DA SILVA JUNIOR - CPF: 352.909.942-20 Origem: FUNDO MUNICIPAL DE SAUDE - BRAGANCA Assunto: CONTAS ANUAIS DE GESTÃO Exercício: 2017 Ministério Público: Procuradora Sra. Maria Regina Franco Cunha Relator: Conselheiro Antonio José Costa de Freitas Guimarães Advogado/Contador: MARIO RIBEIRO DA SILVA JUNIOR - ORDENADOR -  20) Processo nº 065216.2023.2.000 Ordenador: Sr(a). MARCIA BEATRIZ GOMES DA SILVA - CPF: 686.018.082-04 Origem: FUNDEB - SALINOPOLIS Assunto: CONTAS ANUAIS DE GESTÃO Exercício: 2023 Ministério Público: Procuradora Sra. Maria Inez Klautau de Mendonça Gueiros Relator: Conselheiro Antonio José Costa de Freitas Guimarães  21) Processo nº 087403.2023.2.000 Ordenador: Sr(a). GENIVAL FERNANDES DA SILVA - CPF: 791.961.521-68 Origem: FUNDEB - XINGUARA Assunto: CONTAS ANUAIS DE GESTÃO Exercício: 2023 Ministério Público: Procurador Sr. Marcelo Fonseca Barros Relator: Conselheiro Antonio José Costa de Freitas Guimarães  22) Processo nº 014549.2023.2.000 Ordenador: Sr(a). CHRISTIANE FERREIRA DA SILVA - CPF: 560.176.502-20, LEONARDO DE JESUS FARIAS DA SILVA - CPF: 761.386.312-34, SERGIO BRAZAO E SILVA - CPF: 197.707.232-15 Origem: SECRETARIA MUNICIPAL DE MEIO AMBIENTE - BELEM Assunto: CONTAS ANUAIS DE GESTÃO Exercício: 2023 Ministério Público: Procuradora Sra. Maria Regina Franco Cunha Relator: Conselheiro Antonio José Costa de Freitas Guimarães  23) Processo nº 007202.2015.2.000 Ordenador: Sr(a). MARINETE FERNANDES DOS SANTOS - CPF: 490.940.412-00 Origem: FUNDO MUNICIPAL DE SAUDE - ANAJAS Assunto: CONTAS ANUAIS DE GESTÃO Exercício: 2015 Ministério Público: Procuradora Sra. Maria Inez Klautau de Mendonça Gueiros Relator: Conselheira Ann Clélia de Barros Pontes  24) Processo nº 028221.2015.2.000 Ordenador: Sr(a). ADIVALDO BORGES DA SILVA - CPF: 397.227.752-00 Origem: FUNDO MUNICIPAL DE SAUDE - CURRALINHO Assunto: CONTAS ANUAIS DE GESTÃO Exercício: 2015 Ministério Público: Procuradora Sra. Erika Monique Paraense Serra Vasconcellos Relator: Conselheira Ann Clélia de Barros Pontes  25) Processo nº 028221.2016.2.000 Ordenador: Sr(a). ADIVALDO BORGES DA SILVA - CPF: 397.227.752-00 Origem: FUNDO MUNICIPAL DE SAUDE - CURRALINHO Assunto: CONTAS ANUAIS DE GESTÃO Exercício: 2016 Ministério Público: Procuradora Sra. Erika Monique Paraense Serra Vasconcellos Relator: Conselheira Ann Clélia de Barros Pontes  26) Processo nº 062411.2023.2.000 Ordenador: Sr(a). CELIA MORAIS DA SILVA - CPF: 399.224.212-91, MARIA JUCEMA FURTADO CAPELLESSO - CPF: 803.131.082-34, MARIA JUCEMA FURTADO CAPELLESSO - CPF: 803.131.082-34 Origem: FUNDO DO DIREITO DA CRIANÇA E DO ADOLESC - REDENCAO DO PARA Assunto: CONTAS ANUAIS DE GESTÃO Exercício: 2023 Ministério Público: Procuradora Sra. Elisabeth Massoud Salame da Silva Relator: Conselheira Ann Clélia de Barros Pontes Advogado/Contador: AUGUSTO CEZAR DE ALMEIDA VALENTE - CONTADOR - SSP/PA 9289225\nTerça-feira, 01 de abril de 2025 DOE TCMPA Nº 1.921 16    Consulta via leitora de QR Code/ Este Diário Oficial Eletrônico do TCMPA é GRATUITO e sua autenticidade poderá ser confirmada na página do Tribunal de Contas dos Municípios do Estado do Pará na Internet, no Endereço: diario-oficial-eletronico/ 27) Processo nº 063205.2023.2.000 Ordenador: Sr(a). EMILIA SOUZA CARVALHO - CPF: 328.357.28287 Origem: FDCA - RIO MARIA Assunto: CONTAS ANUAIS DE GESTÃO Exercício: 2023 Ministério Público: Procuradora Sra. Erika Monique Paraense Serra Vasconcellos Relator: Conselheira Ann Clélia de Barros Pontes Advogado/Contador: LOURIVAL JOSE MARREIRO DA COSTA - CONTADOR - PC GO 3578882  28) Processo nº 014462.2016.2.000 Ordenador: Sr(a). CAROL LOBATO REZENDE ALVES - CPF: 731.158.272-53 Origem: ESCOLA BOSQUE PROF.EIDORFE MOREIRA - BELEM Assunto: CONTAS ANUAIS DE GESTÃO Exercício: 2016 Ministério Público: Procuradora Sra. Erika Monique Paraense Serra Vasconcellos Relator: Conselheira Ann Clélia de Barros Pontes Advogado/Contador: PAULO NAZARENO CARDOSO DA SILVA - CONTADOR - SSP-PA 5477136  29) Processo nº 014462.2015.2.000 Ordenador: Sr(a). CAROL LOBATO REZENDE ALVES - CPF: 731.158.272-53, FERNANDO COSTA DE QUEIROZ - CPF: 285.039.454-87 Origem: ESCOLA BOSQUE PROF.EIDORFE MOREIRA - BELEM Assunto: CONTAS ANUAIS DE GESTÃO Exercício: 2015 Ministério Público: Procuradora Sra. Erika Monique Paraense Serra Vasconcellos Relator: Conselheira Ann Clélia de Barros Pontes Advogado/Contador: PAULO NAZARENO CARDOSO DA SILVA - CONTADOR - SSP-PA 5477136  30) Processo nº 028212.2015.2.000 Ordenador: Sr(a). ROSIVALDO BORGES PANTOJA - CPF: 623.810.322-15 Origem: IAPSM DE CURRALINHO - CURRALINHO Assunto: CONTAS ANUAIS DE GESTÃO Exercício: 2015 Ministério Público: Procuradora Sra. Erika Monique Paraense Serra Vasconcellos Relator: Conselheira Ann Clélia de Barros Pontes  31) Processo nº 028217.2015.2.000 Ordenador: Sr(a). MARCOS BARATINHA OLIVEIRA - CPF: 577.098.232-20 Origem: SEC MUN DE EDUCACAO E DO DESPORTO - CURRALINHO Assunto: CONTAS ANUAIS DE GESTÃO Exercício: 2015 Ministério Público: Procuradora Sra. Erika Monique Paraense Serra Vasconcellos Relator: Conselheira Ann Clélia de Barros Pontes Advogado/Contador: MARCELO JONATHAN DA SILVA CORREA - CONTADOR - PC 2541509  32) Processo nº 201903533-00 Ordenador/Responsável: Sr(a). FERNANDO ALBERTO CABRAL DA CRUZ - CPF: 123.709.592-15 Origem: PREFEITURA MUNICIPAL DE CURUCA - CURUCA Assunto: RECURSO ORDINÁRIO Exercício: 2012 Ministério Público: Procuradora Sra. Maria Regina Franco Cunha Relator: Conselheiro José Carlos Araújo  33) Processo nº 1.018330.2016.2.0001 Ordenador/Responsável: Sr(a). BENEDITA AUXILIADORA CIRINO DA SILVA - CPF: 353.354.592-04 Origem: FUNDEB - BREVES Assunto: RECURSO ORDINÁRIO Exercício: 2016 Ministério Público: Procuradora Sra. Erika Monique Paraense Serra Vasconcellos Relator: Conselheiro José Carlos Araújo  34) Processo nº 1.067279.2017.2.0000 Ordenador/Responsável: Sr(a). BRENDA CAROLINA RODRIGUES DE ALBUQUERQUE PORTAL - CPF: 936.274.592-53 Origem: SEC MUN DE PROMOCAO E ASSISTENCIA SOCIAL - SANTA CRUZ DO ARARI Assunto: RECURSO ORDINÁRIO Exercício: 2017 Ministério Público: Procuradora Sra. Maria Inez Klautau de Mendonça Gueiros Relator: Conselheiro José Carlos Araújo  35) Processo nº 201514989-00 Ordenador/Responsável: Sr(a). ROSELITO SOARES DA SILVA - CPF: 299.518.601-68 Origem: PREFEITURA MUNICIPAL DE ITAITUBA - ITAITUBA Assunto: RECURSO ORDINÁRIO Exercício: 2008 Ministério Público: Procuradora Sra. Elisabeth Massoud Salame da Silva Relator: Conselheira Mara Lúcia Barbalho da Cruz  36) Processo nº 1.020201.2020.2.0030 Ordenador/Responsável: Sr(a). VANIA MARIA FIGUEIREDO CABRAL - CPF: 222.877.102-30 Origem: IAPSM (CACHOEIRA DO ARARI) - CACHOEIRA DO ARARI Assunto: RECURSO ORDINÁRIO Exercício: 2020 Ministério Público: Procuradora Sra. Erika Monique Paraense Serra Vasconcellos Relator: Conselheiro Antonio José Costa de Freitas Guimarães\n17 DOE TCMPA Nº 1.921 Terça-feira, 01 de abril de 2025    Consulta via leitora de QR Code/ Este Diário Oficial Eletrônico do TCMPA é GRATUITO e sua autenticidade poderá ser confirmada na página do Tribunal de Contas dos Municípios do Estado do Pará na Internet, no Endereço: diario-oficial-eletronico/ 37) Processo nº 1.005002.2018.2.0009 Ordenador/Responsável: Sr(a). BRUNO DENIEL BRILHANTE DOS SANTOS - CPF: 742.827.432-04 Origem: CÂMARA MUNICIPAL DE ALMEIRIM - ALMEIRIM Assunto: PEDIDO DE REVISÃO Exercício: 2018 Ministério Público: Procurador Sr. Marcelo Fonseca Barros Relator: Conselheiro Luis Daniel Lavareda Reis Junior Advogado/Contador: RAFAEL BENTES CORRÊA - ADVOGADO - OAB/PA 16514  38) Processo nº 201905790-00 Ordenador/Responsável: Sr(a). ALVARO BRITO XAVIER - CPF: 089.105.453-72 Origem: PREFEITURA MUNICIPAL DE CONCEIÇÃO DO ARAGUAIA - CONCEIÇÃO DO ARAGUAIA Assunto: PEDIDO DE REVISÃO Exercício: 2006 Ministério Público: Procuradora Sra. Erika Monique Paraense Serra Vasconcellos Relator: Conselheiro Lúcio Dutra Vale  39) Processo nº 201512542-00 Ordenador/Responsável: Sr(a). RAIMUNDO MARTINS CUNHA - CPF: 014.212.202-53 Origem: PREFEITURA MUNICIPAL DE MUANÁ - MUANÁ Assunto: PEDIDO DE REVISÃO Exercício: 2007 Ministério Público: Procuradora Sra. Maria Regina Franco Cunha Relator: Conselheiro Lúcio Dutra Vale  40) Processo nº 202000489-00 Ordenador/Responsável: Sr(a). MADALENA HOFFMAN - CPF: 802.740.051-15 Origem: PREFEITURA MUNICIPAL DE NOVO PROGRESSO - NOVO PROGRESSO Assunto: PEDIDO DE REVISÃO Exercício: 2010 Ministério Público: Procuradora Sra. Erika Monique Paraense Serra Vasconcellos Relator: Conselheiro Lúcio Dutra Vale  41) Processo nº 202003560-00 Ordenador/Responsável: Sr(a). LIDUINA MARIA AARTS DE FARIAS - CPF: 131.110.602-25 Origem: FUNDO MUNICIPAL DE ASSISTÊNCIA SOCIAL - BAIÃO Assunto: PEDIDO DE REVISÃO Exercício: 2009 Ministério Público: Procuradora Sra. Maria Inez Klautau de Mendonça Gueiros Relator: Conselheiro Lúcio Dutra Vale 42) Processo nº 201600349-00 Ordenador/Responsável: Sr(a). JOSE AUGUSTO PONTES MORAES - CPF: 000.479.532-68 Origem: ASSOC. COMUNIT. DO BAIRRO DO GUAMÁ - CENTRO COMUNITÁRIO - BELÉM Assunto: PEDIDO DE REVISÃO Exercício: 2009 Ministério Público: Procuradora Sra. Erika Monique Paraense Serra Vasconcellos Relator: Conselheiro Lúcio Dutra Vale  43) Processo nº 201907322-00 Ordenador/Responsável: Sr(a). SANDRA TEREZA DOS SANTOS BEZERRA - CPF: 212.435.302-00 Origem: SEC MUN DE EDUCACAO - CURUCA Assunto: PEDIDO DE REVISÃO Exercício: 2012 Ministério Público: Procuradora Sra. Erika Monique Paraense Serra Vasconcellos Relator: Conselheiro Lúcio Dutra Vale  44) Processo nº 1.019001.2010.2.0046 Ordenador/Responsável: Sr(a). LÚCIO ANTÔNIO FARO BITENCOURT - CPF: 331.580.962-34 Origem: PREFEITURA MUNICIPAL DE BUJARU - BUJARU Assunto: PEDIDO DE REVISÃO Exercício: 2010 Ministério Público: Procuradora Sra. Erika Monique Paraense Serra Vasconcellos Relator: Conselheira Ann Clélia de Barros Pontes  45) Processo nº 1.067001.2019.1.0010 Ordenador/Responsável: Sr(a). ANTONIO MARIA BARROS DE ALMEIDA - CPF: 301.745.112-72 Origem: PREFEITURA MUNICIPAL DE SANTA CRUZ DO ARARI - SANTA CRUZ DO ARARI Assunto: REPUBLICAÇÃO DE ATO Exercício: 2019 Ministério Público: Procuradora Sra. Elisabeth Massoud Salame da Silva Relator: Conselheiro Luis Daniel Lavareda Reis Junior  46) Processo nº 1.135204.2021.2.0005 Ordenador/Responsável: Sr(a). MARINALDO DE SIQUEIRA DOS SANTOS - CPF: 686.272.892-04 Origem: SEC. MUNICIPAL DE EDUCACAO E DESPORTO - CURUA Assunto: REPUBLICAÇÃO DE ATO Exercício: 2021 Ministério Público: Sem Representante MP Relator: Conselheiro Luis Daniel Lavareda Reis Junior Advogado/Contador: ROOSEVELT JOSE DA SILVA SOUSA - CONTADOR - CRC/PA 10401\nTerça-feira, 01 de abril de 2025 DOE TCMPA Nº 1.921 18    Consulta via leitora de QR Code/ Este Diário Oficial Eletrônico do TCMPA é GRATUITO e sua autenticidade poderá ser confirmada na página do Tribunal de Contas dos Municípios do Estado do Pará na Internet, no Endereço: diario-oficial-eletronico/ 47) Processo nº 1.028212.2019.2.0022 Ordenador/Responsável: Sr(a). VALDOMIRO ANDRADE DE SALES - CPF: 096.910.222-49 Origem: IAPSM DE CURRALINHO - CURRALINHO Assunto: REPUBLICAÇÃO DE ATO Exercício: 2019 Ministério Público: Procuradora Sra. Erika Monique Paraense Serra Vasconcellos Relator: Conselheiro Luis Daniel Lavareda Reis Junior  48) Processo nº 019001.2018.1.000 Ordenador/Responsável: Sr(a). JORGE SATO - CPF: 354.571.47215 Origem: PREFEITURA MUNICIPAL DE BUJARU - BUJARU Assunto: REPUBLICAÇÃO DE ATO Exercício: 2018 Ministério Público: Procurador Sr. Marcelo Fonseca Barros Relator: Conselheiro Lúcio Dutra Vale Advogado/Contador: CARLOS VITTOR DE ANDRADE MONTEIRO - CONTADOR - CRC 15565  Secretaria-Geral do Tribunal de Contas dos Municípios do Estado do Pará, em 31/03/2025.  JORGE ANTONIO CAJANGO PEREIRA Secretário-Geral Protocolo: 52562  DO GABINETE DO CORREGEDOR SOLICITAÇÃO DE PARCELAMENTO CONS. CEZAR COLARES DESPACHO DE SOLICITAÇÃO DE PARCELAMENTO Nº 051/2025 PROCESSO N°: 1.028229.2017.2.0002 PROCEDÊNCIA: FUNDO MUNICIPAL DE ASSISTÊNCIA SOCIAL MUNICÍPIO: CURRALINHO INTERESSADO: THAIS MONIK LERAY DA SILVA CPF: 939.104.602-91 EXERCÍCIO: 2017 ASSUNTO: SOLICITAÇÃO DE PARCELAMENTO DE MULTA AO FUMREAP, REFERENTE A PRESTAÇÃO DE CONTAS CONSTANTE NO PROCESSO Nº 028229.2017.2.000,"
}