{
  "categoria": "acordao",
  "sessao": "17 a 21 de março de 2025",
  "numero": "46.902",
  "publicacao": "1/4/2025",
  "numero_diario": "1.921",
  "apensado": "1.06238.2024.2.0049",
  "natureza": "Aposentadoria",
  "origem": "Instituto de Previdência do Município",
  "exercício": "2020",
  "município": "Redenção",
  "remetente": "Wellington Gonçalves da Silva - CPF n. 626.220.052-53",
  "interessada": "Eliana Marinho Silva - CPF n. 270.427.902-00 Membro",
  "mpctcm": "Marcelo Fonseca Barros",
  "relator": "Conselheiro Substituto Sérgio Dantas",
  "ementa": "APOSENTADORIA POR IDADE. REGISTRO DO ATO. ACORDAM os Membros integrantes da Câmara Especial de Julgamento do Tribunal de Contas dos Municípios do Estado do Pará, reunidos em sessão ordinária, por votação unânime, com fundamento no art. 75, inciso I do Regimento Interno (Ato nº 23/2020, com a alteração do Ato nº 29/2024 - RITCM/PA), conforme ata da sessão e nos termos do relatório e voto do Relator.",
  "decisão": "I. Considerar legal e registrar a Portaria n. 30/2024, de 20/04/2020 do Instituto de Previdência do Município de Redenção do Pará, que concedeu aposentadoria por idade à Sra. Eliana Marinho Silva - CPF 270.427.902-00, no cargo de Agente Comunitário de Saúde com proventos proporcionais no valor de R$ 1.365,78 (Mil, trezentos e sessenta e cinco reais e setenta e oito centavos), com fundamento legal no art. 40, § 1º, III, “b” da Constituição Federal de 1988. 3ª Sessão Plenária Ordinária Virtual da Câmara Especial do Tribunal de Contas dos Municípios do Estado do Pará, de 17 a 21 de março de 2025. Download Anexo - Relatório e Voto do RelatorTerça-feira, 01 de abril de 2025 DOE TCMPA Nº 1.921 4 Consulta via leitora de QR Code/ Este Diário Oficial Eletrônico do TCMPA é GRATUITO e sua autenticidade poderá ser confirmada na página do Tribunal de Contas dos Municípios do Estado do Pará na Internet, no Endereço: diario-oficial-eletronico/",
  "sample_texto": "ACÓRDÃO Nº 46.902 Processo nº: 202031072-00 Apensado: 1.06238.2024.2.0049 Natureza: Aposentadoria Or...",
  "ioepa": "https://tcm.ioepa.com.br/diarios/2025/2025.04.01.DOE.pdf",
  "local": {
    "caminho": "/home/joaompessoa/diario_oficial_tcmpa/diarios/2025/04/2025.04.01.DOE.pdf",
    "pdf": "2025.04.01.DOE.pdf"
  },
  "texto_original": "ACÓRDÃO Nº 46.902 Processo nº: 202031072-00 Apensado: 1.06238.2024.2.0049 Natureza: Aposentadoria Origem: Instituto de Previdência do Município Exercício: 2020 Município: Redenção do Pará Remetente: Wellington Gonçalves da Silva - CPF n. 626.220.052-53 Interessada: Eliana Marinho Silva - CPF n. 270.427.902-00 Membro MPCTCM: Marcelo Fonseca Barros Relator: Conselheiro Substituto Sérgio Dantas EMENTA: APOSENTADORIA POR IDADE. REGISTRO DO ATO. ACORDAM os Membros integrantes da Câmara Especial de Julgamento do Tribunal de Contas dos Municípios do Estado do Pará, reunidos em sessão ordinária, por votação unânime, com fundamento no art. 75, inciso I do Regimento Interno (Ato nº 23/2020, com a alteração do Ato nº 29/2024 - RITCM/PA), conforme ata da sessão e nos termos do relatório e voto do Relator. DECISÃO: I. Considerar legal e registrar a Portaria n. 30/2024, de 20/04/2020 do Instituto de Previdência do Município de Redenção do Pará, que concedeu aposentadoria por idade à Sra. Eliana Marinho Silva - CPF 270.427.902-00, no cargo de Agente Comunitário de Saúde com proventos proporcionais no valor de R$ 1.365,78 (Mil, trezentos e sessenta e cinco reais e setenta e oito centavos), com fundamento legal no art. 40, § 1º, III, “b” da Constituição Federal de 1988. 3ª Sessão Plenária Ordinária Virtual da Câmara Especial do Tribunal de Contas dos Municípios do Estado do Pará, de 17 a 21 de março de 2025. Download Anexo - Relatório e Voto do Relator\nTerça-feira, 01 de abril de 2025 DOE TCMPA Nº 1.921 4    Consulta via leitora de QR Code/ Este Diário Oficial Eletrônico do TCMPA é GRATUITO e sua autenticidade poderá ser confirmada na página do Tribunal de Contas dos Municípios do Estado do Pará na Internet, no Endereço: diario-oficial-eletronico/"
}