{
  "categoria": "acordao",
  "sessao": "01 de abril de 2025",
  "numero": "46.945",
  "publicacao": "1/4/2025",
  "numero_diario": "1.921",
  "município": "Abaetetuba",
  "origem": "Instituto de Previdência do Município - IPMA.",
  "exercício": "2020",
  "natureza": "Pensão",
  "interessados": "Edilson de Jesus Baia Ferreira - CPF n. 659.108.34215 Andrea Monique Rodrigues Quaresma - CPF n. 054.238.422-12",
  "responsável": "Bruna Lorena Lobato Macedo - CPF n. 959.338.67268 Membro do",
  "mpcm": "Maria Inez Mendonça Gueiros",
  "relator": "Conselheiro Substituto Sérgio Dantas",
  "ementa": "PENSÃO POR MORTE. APLICAR MULTA AO ATUAL PRESIDENTE. CIÊNCIA AOS INTERESSADOS. REGISTRO DO ATO. ACORDAM os Membros integrantes da Câmara Especial de Julgamento do Tribunal de Contas dos Municípios do Estado do Pará, reunidos em sessão ordinária, por votação unânime, com fundamento no art. 75, inciso I do Regimento Interno (Ato nº 23/2020, com a alteração do Ato nº 29/2024 - RITCM/PA), conforme ata da sessão e nos termos do relatório e voto do Relator.",
  "decisão": "I. Considerar legal e registrar a Portaria n. 046/2020, de 23.07.2020, do Instituto de Previdência do Município de Abaetetuba, que concedeu pensão por morte, ao Sr. Edilson de Jesus Baia Ferreira (esposo), CPF n. 659.108.342-15, e à Sra. Andrea Monique Rodrigues Quaresma (filha), CPF n. 054.238.42212, em virtude do falecimento da servidora ativa, Sra. Andréa Nogueira Rodrigues, CPF n. 449.941.922-00 no valor de R$ 3.150,60 (Três mil, cento e cinquenta reais e sessenta centavos), com o fundamento no artigo 40, §7º, II da Constituição Federal de 1988, com redação da Emenda Constitucional n. 41/2003, noTerça-feira, 01 de abril de 2025 DOE TCMPA Nº 1.921 6 Consulta via leitora de QR Code/ Este Diário Oficial Eletrônico do TCMPA é GRATUITO e sua autenticidade poderá ser confirmada na página do Tribunal de Contas dos Municípios do Estado do Pará na Internet, no Endereço: diario-oficial-eletronico/ percentual de 50% (cinquenta) do valor do benefício, para cada dependente. II. Aplicar multa no valor de 50 UPF-PA, ao Sr. Ângelo José Lobato Rodrigues (CPF n. 352.316.702-78), Presidente do Instituto de Previdência do Município de Abaetetuba à época da notificação, que deverá ser recolhida ao FUMREAP, no prazo de 30 (trinta) dias, em conformidade com o artigo 3º, III da Lei nº 7.368 /2009, de 29/12/2009, e artigo 695, caput, do RITCMPA, em virtude do não atendimento à Notificação n. 56/2023/TCM-PA/ GAB. CONS. SUBST. SÉRGIO DANTAS, no prazo e forma estabelecido, conforme previsto no art. 699, do RI/TCM-PA c/c os art. 30, § 2º e arts.71, I e 72, da LO/TCM-PA. III. Determinar ao Instituto de Previdência de Abaetetuba que dê ciência ao Sr. Edilson de Jesus Baia Ferreira (CPF n. 659.108.34215) e à Sra. Andrea Monique Rodrigues Quaresma (054.238.42212), acerca desta decisão, para que, querendo, adote medidas complementares que entender cabíveis junto ao próprio Instituto ou ao Poder Judiciário. 3ª Sessão Plenária Ordinária Virtual da Câmara Especial do Tribunal de Contas dos Municípios do Estado do Pará, de 17 a 21 de março de 2025. Download Anexo - Relatório e Voto do Relator",
  "sample_texto": "ACÓRDÃO Nº 46.945 Processo nº: 202032031-00 Município: Abaetetuba Origem: Instituto de Previdência d...",
  "ioepa": "https://tcm.ioepa.com.br/diarios/2025/2025.04.01.DOE.pdf",
  "local": {
    "caminho": "/home/joaompessoa/diario_oficial_tcmpa/diarios/2025/04/2025.04.01.DOE.pdf",
    "pdf": "2025.04.01.DOE.pdf"
  },
  "texto_original": "ACÓRDÃO Nº 46.945 Processo nº: 202032031-00 Município: Abaetetuba Origem: Instituto de Previdência do Município - IPMA. Exercício: 2020 Natureza: Pensão Interessados: Edilson de Jesus Baia Ferreira - CPF n. 659.108.34215 Andrea Monique Rodrigues Quaresma - CPF n. 054.238.422-12 Responsável: Bruna Lorena Lobato Macedo - CPF n. 959.338.67268 Membro do MPCM: Maria Inez Mendonça Gueiros Relator: Conselheiro Substituto Sérgio Dantas EMENTA: PENSÃO POR MORTE. APLICAR MULTA AO ATUAL PRESIDENTE. CIÊNCIA AOS INTERESSADOS. REGISTRO DO ATO. ACORDAM os Membros integrantes da Câmara Especial de Julgamento do Tribunal de Contas dos Municípios do Estado do Pará, reunidos em sessão ordinária, por votação unânime, com fundamento no art. 75, inciso I do Regimento Interno (Ato nº 23/2020, com a alteração do Ato nº 29/2024 - RITCM/PA), conforme ata da sessão e nos termos do relatório e voto do Relator. DECISÃO: I. Considerar legal e registrar a Portaria n. 046/2020, de 23.07.2020, do Instituto de Previdência do Município de Abaetetuba, que concedeu pensão por morte, ao Sr. Edilson de Jesus Baia Ferreira (esposo), CPF n. 659.108.342-15, e à Sra. Andrea Monique Rodrigues Quaresma (filha), CPF n. 054.238.42212, em virtude do falecimento da servidora ativa, Sra. Andréa Nogueira Rodrigues, CPF n. 449.941.922-00 no valor de R$ 3.150,60 (Três mil, cento e cinquenta reais e sessenta centavos), com o fundamento no artigo 40, §7º, II da Constituição Federal de 1988, com redação da Emenda Constitucional n. 41/2003, no\nTerça-feira, 01 de abril de 2025 DOE TCMPA Nº 1.921 6    Consulta via leitora de QR Code/ Este Diário Oficial Eletrônico do TCMPA é GRATUITO e sua autenticidade poderá ser confirmada na página do Tribunal de Contas dos Municípios do Estado do Pará na Internet, no Endereço: diario-oficial-eletronico/ percentual de 50% (cinquenta) do valor do benefício, para cada dependente. II. Aplicar multa no valor de 50 UPF-PA, ao Sr. Ângelo José Lobato Rodrigues (CPF n. 352.316.702-78), Presidente do Instituto de Previdência do Município de Abaetetuba à época da notificação, que deverá ser recolhida ao FUMREAP, no prazo de 30 (trinta) dias, em conformidade com o artigo 3º, III da Lei nº 7.368 /2009, de 29/12/2009, e artigo 695, caput, do RITCMPA, em virtude do não atendimento à Notificação n. 56/2023/TCM-PA/ GAB. CONS. SUBST. SÉRGIO DANTAS, no prazo e forma estabelecido, conforme previsto no art. 699, do RI/TCM-PA c/c os art. 30, § 2º e arts.71, I e 72, da LO/TCM-PA. III. Determinar ao Instituto de Previdência de Abaetetuba que dê ciência ao Sr. Edilson de Jesus Baia Ferreira (CPF n. 659.108.34215) e à Sra. Andrea Monique Rodrigues Quaresma (054.238.42212), acerca desta decisão, para que, querendo, adote medidas complementares que entender cabíveis junto ao próprio Instituto ou ao Poder Judiciário. 3ª Sessão Plenária Ordinária Virtual da Câmara Especial do Tribunal de Contas dos Municípios do Estado do Pará, de 17 a 21 de março de 2025. Download Anexo - Relatório e Voto do Relator"
}