{
  "categoria": "acordao",
  "sessao": "13 a 15 de dezembro de 2022",
  "numero": "41.838",
  "publicacao": "1/4/2025",
  "numero_diario": "1.921",
  "processo": "081397.2020.2.000",
  "município": "Senador José Porfírio",
  "gestora": "Fundo Municipal de Saúde",
  "assunto": "Contas Anuais de Gestão – Exercício 2020",
  "interessada(s)": "Edla Cristina Alves Da Costa – CPF: 297.322.042-49 Período – 01/01 até 05/04/2020 Anete Neucyane Viana Costa Souza – CPF: 395.395.202-15 Período – 06/04 até 31/12 /2020",
  "relator": "Conselheiro José Carlos Araújo Procurador(a)",
  "mpcm": "Maria Inez Klautau Gueiros",
  "ementa": "Prestação de Contas de Gestão. Fundo Municipal de Saúde de Senador José Porfírio. Exercício de 2020. Regular com ressalvas. Aplicação de multas. Alvará de Quitação as ordenadoras após recolhimento das multas. ACORDAM, à unanimidade, os Conselheiros do pleno do Tribunal de Contas dos Municípios do Estado do Pará, nos termos do relatório e voto do Relator,",
  "decisão": "I – Considerar regular com ressalvas as contas do Fundo Municipal de Saúde de Senador José Porfírio, de responsabilidade das ordenadoras Edla Cristina Alves da Costa, no período de 01/01 até 05/04/2020 e Anete Neucyane Viana Costa da Souza, no período de 06/04 até 31/12 /2020, com fundamento no artigo 45, inciso II da Lei Estadual nº 109/2016; II – Aplicar as ordenadoras as multas abaixo, que deverão ser recolhidas ao FUMREAP, instituído pela Lei nº 7.368/2009 de 29/12/2009, no prazo de 30 (trinta) dias, conforme previsão do art. 695, caput, do RI/TCM-PA: Ordenadora Edla Cristina Alves Da Costa – Período de 01/01 até 05/04/2020 1. Multa na quantidade de 300 UPF-PA prevista no Artigo 72 da Lei Complementar 109/16 inciso X, pelo não encaminhamento ao Sistema Integrado de Atos de Pessoal – SIAP, dos atos de admissão temporária de pessoal, em descumprimento às normas regimentais. 2. Multa na quantidade de 300 UPF-PA prevista no Artigo 72 da Lei Complementar 109/16 inciso VII, pela incorreta apropriação e recolhimento das obrigações patronais, no montante de R$-32.332,27, em descumprimento ao disposto no art. 35 da Lei Federal 4.320/64 c/c o art. 50 inciso II da Lei de Responsabilidade Fiscal. Ordenadora Anete Neucyane Viana Costa – Período – 06/04 até 31/12 /2020 1. Multa na quantidade de 300 UPF-PA prevista no Artigo 72 da Lei Complementar 109/16 inciso X, pelo não encaminhamento ao Sistema Integrado de Atos de Pessoal – SIAP dos atos de admissão temporária de pessoal, em descumprimento às normas regimentais; 2. Multa na quantidade de 300 UPF-PA prevista no Artigo 72 da Lei Complementar 109/16 inciso(s) X, pela incorreta apropriação e recolhimento das obrigações patronais, no montante de R$-159.315,52, em descumprimento ao disposto no art. 35 da Lei Federal 4.320/64 c/c o art. 50 inciso II da Lei de Responsabilidade Fiscal. 3. Multa na quantidade de 300 UPF-PA prevista no Artigo 72 da Lei Complementar 109/16 inciso VII, pelo não envio do Parecer relativo ao 3º quadrimestre do Conselho Municipal de Saúde que apreciou as prestações de contas do exercício em exame, em descumprimento às normas regimentais; III – Cientificar as ordenadoras que o não recolhimento das multas aplicadas, na forma e prazo fixados, após o trânsito em julgado da presente decisão, resultará nos acréscimos decorrentes da mora, nos termos do art. 703, incisos I, a III, do RITCM-PA e, ainda, no caso de não atendimento de referidas determinações, fica à Secretaria-Geral/TCM-PA autorizada a proceder com os trâmites necessários para o efetivo protesto e execução do título, na forma regimental; IV - Expedir o alvará de quitação as Ordenadoras Edla Cristina Alves Da Costa e Anete Neucyane Viana Costa, no valor de R$-2.015.798,43 (dois milhões, quinze mil, setecentos e noventa e oito reais e quarenta e três centavos) e R$-8.473.881,43 (oito milhões, quatrocentos e setenta e três mil, oitocentos e oitenta e um reais e quarenta e três centavos) respectivamente, após o recolhimento das multas imputadas. Sessão Virtual do Pleno do Tribunal de Contas dos Municípios do Estado do Pará, de 13 a 15 de dezembro de 2022. Download Anexo - Relatório e Voto do Relator ACORDÃO Nº 46.455/2025 Processo nº 202001388-00 (Juntado ao processo nº 49001201400)",
  "origem": "Prefeitura Municipal de Muaná Assunto: Recurso Ordinário – Prestação de Contas de Gestão 20147 DOE TCMPA Nº 1.921 Terça-feira, 01 de abril de 2025 Consulta via leitora de QR Code/ Este Diário Oficial Eletrônico do TCMPA é GRATUITO e sua autenticidade poderá ser confirmada na página do Tribunal de Contas dos Municípios do Estado do Pará na Internet, no Endereço: diario-oficial-eletronico/",
  "responsável": "Sérgio Murilo dos Santos Guimarães – CPF: 451.024.652-87",
  "advogado": "Sem Advogado Constituído Relator: Conselheiro Luis Daniel Lavareda Reis Junior",
  "mpc": "Erika Monique Paraense Serra Vasconcellos EMENTA: RECURSO ORDINÁRIO. PREFEITURA MUNICIPAL DE MUANÁ. CONTAS DE GESTÃO. EXERCÍCIO FINANCEIRO DE 2013. CONHECIMENTO E PROVIMENTO PARCIAL. REDUZIR O MONTANTE DE DESPESAS REALIZADAS SEM A COMPROVAÇÃO DOS PROCESSOS LICITATÓRIOS. MANUTENÇÃO DOS TERMOS DO ACÓRDÃO 35.901/2020. REPROVAÇÃO DAS CONTAS DE GESTÃO. MANUTENÇÃO DAS MULTAS FIXADAS. UNANIMIDADE. Vistos, relatados e discutidos os autos que tratam do Recurso Ordinário impetrado pelo Sr. Sérgio Murilo dos Santos Guimarães – ex-Prefeito, do município de Muaná, exercício financeiro de 2014, contra o Acórdão nº 35.901/2020, que emitiu decisão contrária a aprovação das contas de Gestão da Prefeitura Municipal. Resolvem, por unanimidade, os Conselheiros do Tribunal de Contas dos Municípios do Estado do Pará, nos termos da Ata da sessão e do Relatório e Voto do Conselheiro Relator, nos seguintes termos. DECISÃO: Pelo CONHECIMENTO DO RECURSO, e no mérito, PELO PROVIMENTO PARCIAL, reduzindo o montante das despesas realizadas sem a comprovação de processo licitatório para o valor de R$-6.104.352,12 (seis milhões, cento e quatro mil trezentos e cinquenta e dois reais e doze centavos), mantendo-se os termos do Acórdão nº 35.901/2020, pela não aprovação das Contas de Gestão da Prefeitura Municipal de Muaná, exercício de 2014, sem prejuízo na manutenção das multas fixadas pelas falhas remanescentes, quais sejam: remessa intempestiva de documentos obrigatórios; remessa intempestiva do envio processos licitatórios e contratos no Mural de Licitação e despesas sem comprovação de processos licitatórios. Sala das Sessões do Tribunal de Contas dos Municípios do Estado do Pará, em 23 de janeiro de 2025. Download Anexo - Relatório e Voto do Relator",
  "sample_texto": "ACÓRDÃO Nº 41.838 Processo nº 081397.2020.2.000 Município: Senador José Porfírio Unidade Gestora: Fu...",
  "ioepa": "https://tcm.ioepa.com.br/diarios/2025/2025.04.01.DOE.pdf",
  "local": {
    "caminho": "/home/joaompessoa/diario_oficial_tcmpa/diarios/2025/04/2025.04.01.DOE.pdf",
    "pdf": "2025.04.01.DOE.pdf"
  },
  "texto_original": "ACÓRDÃO Nº 41.838 Processo nº 081397.2020.2.000 Município: Senador José Porfírio Unidade Gestora: Fundo Municipal de Saúde Assunto: Contas Anuais de Gestão – Exercício 2020 Interessada(s): Edla Cristina Alves Da Costa – CPF: 297.322.042-49 Período – 01/01 até 05/04/2020 Anete Neucyane Viana Costa Souza – CPF: 395.395.202-15 Período – 06/04 até 31/12 /2020 Relator: Conselheiro José Carlos Araújo Procurador(a) MPCM: Maria Inez Klautau Gueiros EMENTA: Prestação de Contas de Gestão. Fundo Municipal de Saúde de Senador José Porfírio. Exercício de 2020. Regular com ressalvas. Aplicação de multas. Alvará de Quitação as ordenadoras após recolhimento das multas. ACORDAM, à unanimidade, os Conselheiros do pleno do Tribunal de Contas dos Municípios do Estado do Pará, nos termos do relatório e voto do Relator, DECISÃO: I – Considerar regular com ressalvas as contas do Fundo Municipal de Saúde de Senador José Porfírio, de responsabilidade das ordenadoras Edla Cristina Alves da Costa, no período de 01/01 até 05/04/2020 e Anete Neucyane Viana Costa da Souza, no período de 06/04 até 31/12 /2020, com fundamento no artigo 45, inciso II da Lei Estadual nº 109/2016; II – Aplicar as ordenadoras as multas abaixo, que deverão ser recolhidas ao FUMREAP, instituído pela Lei nº 7.368/2009 de 29/12/2009, no prazo de 30 (trinta) dias, conforme previsão do art. 695, caput, do RI/TCM-PA: Ordenadora Edla Cristina Alves Da Costa – Período de 01/01 até 05/04/2020 1. Multa na quantidade de 300 UPF-PA prevista no Artigo 72 da Lei Complementar 109/16 inciso X, pelo não encaminhamento ao Sistema Integrado de Atos de Pessoal – SIAP, dos atos de admissão temporária de pessoal, em descumprimento às normas regimentais. 2. Multa na quantidade de 300 UPF-PA prevista no Artigo 72 da Lei Complementar 109/16 inciso VII, pela incorreta apropriação e recolhimento das obrigações patronais, no montante de R$-32.332,27, em descumprimento ao disposto no art. 35 da Lei Federal 4.320/64 c/c o art. 50 inciso II da Lei de Responsabilidade Fiscal. Ordenadora Anete Neucyane Viana Costa – Período – 06/04 até 31/12 /2020 1. Multa na quantidade de 300 UPF-PA prevista no Artigo 72 da Lei Complementar 109/16 inciso X, pelo não encaminhamento ao Sistema Integrado de Atos de Pessoal – SIAP dos atos de admissão temporária de pessoal, em descumprimento às normas regimentais; 2. Multa na quantidade de 300 UPF-PA prevista no Artigo 72 da Lei Complementar 109/16 inciso(s) X, pela incorreta apropriação e recolhimento das obrigações patronais, no montante de R$-159.315,52, em descumprimento ao disposto no art. 35 da Lei Federal 4.320/64 c/c o art. 50 inciso II da Lei de Responsabilidade Fiscal. 3. Multa na quantidade de 300 UPF-PA prevista no Artigo 72 da Lei Complementar 109/16 inciso VII, pelo não envio do Parecer relativo ao 3º quadrimestre do Conselho Municipal de Saúde que apreciou as prestações de contas do exercício em exame, em descumprimento às normas regimentais; III – Cientificar as ordenadoras que o não recolhimento das multas aplicadas, na forma e prazo fixados, após o trânsito em julgado da presente decisão, resultará nos acréscimos decorrentes da mora, nos termos do art. 703, incisos I, a III, do RITCM-PA e, ainda, no caso de não atendimento de referidas determinações, fica à Secretaria-Geral/TCM-PA autorizada a proceder com os trâmites necessários para o efetivo protesto e execução do título, na forma regimental; IV - Expedir o alvará de quitação as Ordenadoras Edla Cristina Alves Da Costa e Anete Neucyane Viana Costa, no valor de R$-2.015.798,43 (dois milhões, quinze mil, setecentos e noventa e oito reais e quarenta e três centavos) e R$-8.473.881,43 (oito milhões, quatrocentos e setenta e três mil, oitocentos e oitenta e um reais e quarenta e três centavos) respectivamente, após o recolhimento das multas imputadas. Sessão Virtual do Pleno do Tribunal de Contas dos Municípios do Estado do Pará, de 13 a 15 de dezembro de 2022. Download Anexo - Relatório e Voto do Relator  ACORDÃO Nº 46.455/2025 Processo nº 202001388-00 (Juntado ao processo nº 49001201400) Origem: Prefeitura Municipal de Muaná Assunto: Recurso Ordinário – Prestação de Contas de Gestão 2014\n7 DOE TCMPA Nº 1.921 Terça-feira, 01 de abril de 2025    Consulta via leitora de QR Code/ Este Diário Oficial Eletrônico do TCMPA é GRATUITO e sua autenticidade poderá ser confirmada na página do Tribunal de Contas dos Municípios do Estado do Pará na Internet, no Endereço: diario-oficial-eletronico/ Responsável: Sérgio Murilo dos Santos Guimarães – CPF: 451.024.652-87 Advogado: Sem Advogado Constituído Relator: Conselheiro Luis Daniel Lavareda Reis Junior MPC: Erika Monique Paraense Serra Vasconcellos EMENTA: RECURSO ORDINÁRIO. PREFEITURA MUNICIPAL DE MUANÁ. CONTAS DE GESTÃO. EXERCÍCIO FINANCEIRO DE 2013. CONHECIMENTO E PROVIMENTO PARCIAL. REDUZIR O MONTANTE DE DESPESAS REALIZADAS SEM A COMPROVAÇÃO DOS PROCESSOS LICITATÓRIOS. MANUTENÇÃO DOS TERMOS DO ACÓRDÃO 35.901/2020. REPROVAÇÃO DAS CONTAS DE GESTÃO. MANUTENÇÃO DAS MULTAS FIXADAS. UNANIMIDADE. Vistos, relatados e discutidos os autos que tratam do Recurso Ordinário impetrado pelo Sr. Sérgio Murilo dos Santos Guimarães – ex-Prefeito, do município de Muaná, exercício financeiro de 2014, contra o Acórdão nº 35.901/2020, que emitiu decisão contrária a aprovação das contas de Gestão da Prefeitura Municipal. Resolvem, por unanimidade, os Conselheiros do Tribunal de Contas dos Municípios do Estado do Pará, nos termos da Ata da sessão e do Relatório e Voto do Conselheiro Relator, nos seguintes termos. DECISÃO: Pelo CONHECIMENTO DO RECURSO, e no mérito, PELO PROVIMENTO PARCIAL, reduzindo o montante das despesas realizadas sem a comprovação de processo licitatório para o valor de R$-6.104.352,12 (seis milhões, cento e quatro mil trezentos e cinquenta e dois reais e doze centavos), mantendo-se os termos do Acórdão nº 35.901/2020, pela não aprovação das Contas de Gestão da Prefeitura Municipal de Muaná, exercício de 2014, sem prejuízo na manutenção das multas fixadas pelas falhas remanescentes, quais sejam: remessa intempestiva de documentos obrigatórios; remessa intempestiva do envio processos licitatórios e contratos no Mural de Licitação e despesas sem comprovação de processos licitatórios. Sala das Sessões do Tribunal de Contas dos Municípios do Estado do Pará, em 23 de janeiro de 2025. Download Anexo - Relatório e Voto do Relator"
}