{
  "categoria": "acordao",
  "sessao": "10 a 14 de março de 2025",
  "numero": "46.855",
  "publicacao": "26/3/2025",
  "numero_diario": "1.917",
  "processo": "202103427",
  "município": "Peixe-Boi",
  "órgão": "Câmara Municipal",
  "exercício": "2016",
  "ordenador": "Francisco Oliveira de Souza (CPF:[REDIGIDO])",
  "assunto": "Recurso Ordinário contra a decisão objeto do Acórdão nº 37.031/TCM-PA, de 02/09/2020. Procurador(a)",
  "mpcm": "Marcelo Fonseca Barros",
  "relator": "Conselheiro José Carlos Araújo",
  "ementa": "Recurso Ordinário contra a decisão objeto do Acórdão nº 37.031/TCM-PA, de 02/09/2020. Câmara Municipal de PeixeBoi. Exercício 2016. Provimento Parcial. Aprovação com ressalvas. Aplicação de multa. ACORDAM os Conselheiros do Tribunal de Contas dos Municípios do Estado do Pará, por votação unânime, em conformidade com a ata da sessão e nos termos do relatório e voto do Conselheiro Relator,",
  "decisão": "I – Conhecer do presente Recurso Ordinário, e no mérito, pelo seu provimento parcial, reformando em parte o Acórdão nº 37.031/TCM-PA, de 02/09/2020, em que passa a constar a aprovação com ressalvas das contas do Sr. Francisco Oliveira de Souza (CPF: 742.238.732-00), Ordenador de Despesas da Câmara Municipal de Peixe-Boi, exercício financeiro de 2016, mantendo a multa, na quantidade de 300 UPF-PA, prevista no art. 698, inciso IV, alínea “b”, do RI/TCM-PA, pela não apropriação das obrigações patronais do exercício, em razão do descumprimento ao art. 195, I, “a”, da Constituição Federal, Art. 30, I, “b”, da Lei Federal nº. 8.212/9112 e art. 50, II, da LC 101/00. Sessão Virtual do Pleno do Tribunal de Contas dos Municípios do Estado do Pará, de 10 a 14 de março de 2025. Download Anexo - Relatório e Voto do Relator RESOLUÇÃO RESOLUÇÃO Nº 17.206 Processo nº 066001.2016.1.000 Município: Salvaterra Unidade",
  "gestora": "Prefeitura Municipal5 DOE TCMPA Nº 1.917 Quarta-feira, 26 de março de 2025 Consulta via leitora de QR Code/ Este Diário Oficial Eletrônico do TCMPA é GRATUITO e sua autenticidade poderá ser confirmada na página do Tribunal de Contas dos Municípios do Estado do Pará na Internet, no Endereço: diario-oficial-eletronico/ Exercício: 2016",
  "interessado(s)": "Valentim Lucas de Oliveira CPF Nº 293.686.262-00",
  "contador(a)": "Maria do Socorro Pinto Alves Batista",
  "instrução": "1ª Controladoria",
  "relatora": "Conselheira Ann Pontes EMENTA: PRESTAÇÃO DE CONTAS DO CHEFE DO PODER EXECUTIVO. PREFEITURA MUNICIPAL DE SALVATERRA. EXERCÍCIO 2016. 1. AO FINAL DA INSTRUÇÃO PROCESSUAL, PERMANECERAM AS SEGUINTES",
  "irregularidades": "1) REMESSA INTEMPESTIVA DA PRESTAÇÃO DE CONTAS MENSAL E QUADRIMESTRAL, 2) FALHAS FORMAIS DETECTADAS NOS PROCESSOS LICITATÓRIOS REMETIDOS, 3) DESCUMPRIMENTO DE PARTE DAS OBRIGAÇÕES PACTUADAS NO TAG Nº 037/2017/TCM/PA, 4) INCORRETA APROPRIAÇÃO (EMPENHAMENTO) E RECOLHIMENTO DAS OBRIGAÇÕES PATRONAIS. FALHAS DESSAS NATUREZAS NÃO COMPROMETEM A REGULARIDADE DAS CONTAS, MAS SUJEITAM O ORDENADOR À APLICAÇÃO DE MULTAS. 2. PELA REGULARIDADE COM RESSALVAS DAS CONTA. MULTAS AO FUMREAP. RECOLHIMENTO AO ERÁRIO MUNICIPAL. RESOLVEM os Conselheiros do Tribunal de Contas dos Municípios do Estado do Pará, por votação unânime, em conformidade com a ata da sessão e nos termos do relatório e voto da Conselheira Relatora: DECISÃO: I. VOTAM, com fundamento no art. 37, inciso II, da Lei Complementar Estadual nº. 109/2016, pela emissão de Parecer Prévio recomendando à Câmara Municipal de Salvaterra, a APROVAÇÃO, COM RESSALVAS, das Contas anuais do exercício de 2016, de responsabilidade do Sr. Valentim Lucas de Oliveira. II. DEVE o Ordenador recolher os seguintes valores: 1) Ao FUMREAP/TCM/PA, instituído pela Lei nº. 7.368/2009, de 29/12/2009, no prazo de 30 (trinta) dias, conforme previsão do art. 695, caput, do RI/TCM-PA: A) 400 UPFPA, com fundamento no artigo 698, inciso IV, alínea “b”, do RI/TCM/PA, pela remessa intempestiva da prestação de contas mensal e quadrimestral, descumprindo o art. 335, incisos III, V e §4º, do Regimento Interno do TCM/PA c/c IN Nº. 002/2019-TCM/ PA; B) 600 UPF-PA, prevista no artigo 698, inciso IV, alínea “b”, do RI/TCM/PA, pelas falhas formais detectadas nos Processos Licitatórios remetidos, descumprindo o disposto nas Resoluções nºs. 11.535/2014-TCM/PA, e alterado pela de nº. 11.832/2015TCM/PA, C) 3.000 UPF-PA, aplicada conforme Resolução nº 13.828/2017, em virtude do descumprimento de parte das obrigações pactuadas no TAG Nº 037/2017/TCM/PA. 2) Ao ERÁRIO MUNICIPAL, nos termos do art. 712, inciso I, e parágrafo único, do RI/TCM/PA, no prazo de 30 (trinta) dias, a contar do trânsito em julgado da decisão, nos termos do art. 714, do mesmo diploma legal: A) 500 UPF-PA, prevista no artigo 698, inciso IV, alínea “b”, do RI/TCM/PA, pela incorreta apropriação (empenhamento) e recolhimento das Obrigações Patronais, descumprindo art. 216, inciso I, alínea “b”, do Decreto Federal nº. 3.048/1999. III. E, também, que o Ordenador FIQUE CIENTE de que o não recolhimento das multas aplicadas, na forma e prazo fixados, após o trânsito em julgado da presente decisão, resultará nos acréscimos decorrentes de mora, nos termos do art. 703, incisos I a III, do RI/TCM/PA e, ainda, no caso de não atendimento de referidas determinações, fica a Secretaria-Geral/TCM/PA autorizada a proceder com os trâmites necessários para o efetivo protesto e execução do título, na forma regimental. III. Por fim, após o trânsito em julgado desta decisão, que a Secretaria-Geral proceda o encaminhamento das prestações de contas, de forma eletrônica, ao(a) Presidente da Câmara Municipal de Salvaterra, para que este promova o processamento e julgamento deste Parecer Prévio, no prazo de 90 (noventa) dias, conforme determina o art. 71, §2º, da Constituição Estadual, bem como informe ao TCM/PA o resultado do julgamento, sob pena de envio dos autos ao Ministério Público, para apuração do crime de improbidade, por violação do art. 11, inciso II, da Lei nº 8.429/92, sem prejuízo de outras sanções que vier imputar o Tribunal, seja de natureza pecuniária, seja de ponto de controle para reprovação de suas contas. 4ª Sessão Virtual do Tribunal de Contas dos Municípios do Estado do Pará de 10 a 14 de março de 2025. Download Anexo - Relatório e Voto do Relator DO GABINETE DO VICE-PRESIDENTE DECISÃO MONOCRÁTICA CONS. DANIEL LAVAREDA DECISÃO MONOCRÁTICA DA VICE-PRESIDÊNCIA (JUÍZO DE ADMISSIBILIDADE DE RECURSO ORDINÁRIO) Processo nº: 1.010002.2023.2.0010 Processo",
  "apensado": "010002.2023.2.000",
  "classe": "Recurso Ordinário",
  "procedência": "Câmara Municipal de Aveiro",
  "responsável": "Antônio Elidio da Freita Silva Decisão",
  "recorrida": "Acórdão nº 46.379/2024 Assunto: Contas Anuais de Gestão Exercício: 2023 Tratam os autos de Recurso Ordinário, interposto pelo Sr. ANTONIO ELIDIO DA FREITA SILVA, responsável legal pela prestação de contas anuais da CÂMARA MUNICIPAL DE AVEIRO, exercício financeiro de 2023, com arrimo no art. 81, caput, da LC nº. 109/2016 c/c art. 604 e seguintes do RITCM-PA (Ato 23), contra a decisão contida na",
  "sample_texto": "ACÓRDÃO Nº 46.855 Processo nº 202103427-00 (056002.2016.2.000) Município: Peixe-Boi Órgão: Câmara Mu...",
  "ioepa": "https://tcm.ioepa.com.br/diarios/2025/2025.03.26.DOE.pdf",
  "local": {
    "caminho": "/home/joaompessoa/diario_oficial_tcmpa/diarios/2025/03/2025.03.26.DOE.pdf",
    "pdf": "2025.03.26.DOE.pdf"
  },
  "texto_original": "ACÓRDÃO Nº 46.855 Processo nº 202103427-00 (056002.2016.2.000) Município: Peixe-Boi Órgão: Câmara Municipal Exercício: 2016 Ordenador: Francisco Oliveira de Souza (CPF:742.238.732-00) Assunto: Recurso Ordinário contra a decisão objeto do Acórdão nº 37.031/TCM-PA, de 02/09/2020. Procurador(a) MPCM: Marcelo Fonseca Barros Relator: Conselheiro José Carlos Araújo EMENTA: Recurso Ordinário contra a decisão objeto do Acórdão nº 37.031/TCM-PA, de 02/09/2020. Câmara Municipal de PeixeBoi. Exercício 2016. Provimento Parcial. Aprovação com ressalvas. Aplicação de multa. ACORDAM os Conselheiros do Tribunal de Contas dos Municípios do Estado do Pará, por votação unânime, em conformidade com a ata da sessão e nos termos do relatório e voto do Conselheiro Relator, DECISÃO: I – Conhecer do presente Recurso Ordinário, e no mérito, pelo seu provimento parcial, reformando em parte o Acórdão nº 37.031/TCM-PA, de 02/09/2020, em que passa a constar a aprovação com ressalvas das contas do Sr. Francisco Oliveira de Souza (CPF: 742.238.732-00), Ordenador de Despesas da Câmara Municipal de Peixe-Boi, exercício financeiro de 2016, mantendo a multa, na quantidade de 300 UPF-PA, prevista no art. 698, inciso IV, alínea “b”, do RI/TCM-PA, pela não apropriação das obrigações patronais do exercício, em razão do descumprimento ao art. 195, I, “a”, da Constituição Federal, Art. 30, I, “b”, da Lei Federal nº. 8.212/9112 e art. 50, II, da LC 101/00. Sessão Virtual do Pleno do Tribunal de Contas dos Municípios do Estado do Pará, de 10 a 14 de março de 2025. Download Anexo - Relatório e Voto do Relator  RESOLUÇÃO RESOLUÇÃO Nº 17.206 Processo nº 066001.2016.1.000 Município: Salvaterra Unidade Gestora: Prefeitura Municipal\n5 DOE TCMPA Nº 1.917 Quarta-feira, 26 de março de 2025    Consulta via leitora de QR Code/ Este Diário Oficial Eletrônico do TCMPA é GRATUITO e sua autenticidade poderá ser confirmada na página do Tribunal de Contas dos Municípios do Estado do Pará na Internet, no Endereço: diario-oficial-eletronico/ Exercício: 2016 Interessado(s): Valentim Lucas de Oliveira CPF Nº 293.686.262-00 Contador(a): Maria do Socorro Pinto Alves Batista Instrução: 1ª Controladoria Assunto: Prestação de Contas do Chefe do Poder Executivo MPCM/PA: Procurador Maria Regina Cunha Relatora: Conselheira Ann Pontes EMENTA: PRESTAÇÃO DE CONTAS DO CHEFE DO PODER EXECUTIVO. PREFEITURA MUNICIPAL DE SALVATERRA. EXERCÍCIO 2016. 1. AO FINAL DA INSTRUÇÃO PROCESSUAL, PERMANECERAM AS SEGUINTES IRREGULARIDADES: 1) REMESSA INTEMPESTIVA DA PRESTAÇÃO DE CONTAS MENSAL E QUADRIMESTRAL, 2) FALHAS FORMAIS DETECTADAS NOS PROCESSOS LICITATÓRIOS REMETIDOS, 3) DESCUMPRIMENTO DE PARTE DAS OBRIGAÇÕES PACTUADAS NO TAG Nº 037/2017/TCM/PA, 4) INCORRETA APROPRIAÇÃO (EMPENHAMENTO) E RECOLHIMENTO DAS OBRIGAÇÕES PATRONAIS. FALHAS DESSAS NATUREZAS NÃO COMPROMETEM A REGULARIDADE DAS CONTAS, MAS SUJEITAM O ORDENADOR À APLICAÇÃO DE MULTAS. 2. PELA REGULARIDADE COM RESSALVAS DAS CONTA. MULTAS AO FUMREAP. RECOLHIMENTO AO ERÁRIO MUNICIPAL. RESOLVEM os Conselheiros do Tribunal de Contas dos Municípios do Estado do Pará, por votação unânime, em conformidade com a ata da sessão e nos termos do relatório e voto da Conselheira Relatora: DECISÃO: I. VOTAM, com fundamento no art. 37, inciso II, da Lei Complementar Estadual nº. 109/2016, pela emissão de Parecer Prévio recomendando à Câmara Municipal de Salvaterra, a APROVAÇÃO, COM RESSALVAS, das Contas anuais do exercício de 2016, de responsabilidade do Sr. Valentim Lucas de Oliveira. II. DEVE o Ordenador recolher os seguintes valores: 1) Ao FUMREAP/TCM/PA, instituído pela Lei nº. 7.368/2009, de 29/12/2009, no prazo de 30 (trinta) dias, conforme previsão do art. 695, caput, do RI/TCM-PA: A) 400 UPFPA, com fundamento no artigo 698, inciso IV, alínea “b”, do RI/TCM/PA, pela remessa intempestiva da prestação de contas mensal e quadrimestral, descumprindo o art. 335, incisos III, V e §4º, do Regimento Interno do TCM/PA c/c IN Nº. 002/2019-TCM/ PA; B) 600 UPF-PA, prevista no artigo 698, inciso IV, alínea “b”, do RI/TCM/PA, pelas falhas formais detectadas nos Processos Licitatórios remetidos, descumprindo o disposto nas Resoluções nºs. 11.535/2014-TCM/PA, e alterado pela de nº. 11.832/2015TCM/PA, C) 3.000 UPF-PA, aplicada conforme Resolução nº 13.828/2017, em virtude do descumprimento de parte das obrigações pactuadas no TAG Nº 037/2017/TCM/PA. 2) Ao ERÁRIO MUNICIPAL, nos termos do art. 712, inciso I, e parágrafo único, do RI/TCM/PA, no prazo de 30 (trinta) dias, a contar do trânsito em julgado da decisão, nos termos do art. 714, do mesmo diploma legal: A) 500 UPF-PA, prevista no artigo 698, inciso IV, alínea “b”, do RI/TCM/PA, pela incorreta apropriação (empenhamento) e recolhimento das Obrigações Patronais, descumprindo art. 216, inciso I, alínea “b”, do Decreto Federal nº. 3.048/1999. III. E, também, que o Ordenador FIQUE CIENTE de que o não recolhimento das multas aplicadas, na forma e prazo fixados, após o trânsito em julgado da presente decisão, resultará nos acréscimos decorrentes de mora, nos termos do art. 703, incisos I a III, do RI/TCM/PA e, ainda, no caso de não atendimento de referidas determinações, fica a Secretaria-Geral/TCM/PA autorizada a proceder com os trâmites necessários para o efetivo protesto e execução do título, na forma regimental. III. Por fim, após o trânsito em julgado desta decisão, que a Secretaria-Geral proceda o encaminhamento das prestações de contas, de forma eletrônica, ao(a) Presidente da Câmara Municipal de Salvaterra, para que este promova o processamento e julgamento deste Parecer Prévio, no prazo de 90 (noventa) dias, conforme determina o art. 71, §2º, da Constituição Estadual, bem como informe ao TCM/PA o resultado do julgamento, sob pena de envio dos autos ao Ministério Público, para apuração do crime de improbidade, por violação do art. 11, inciso II, da Lei nº 8.429/92, sem prejuízo de outras sanções que vier imputar o Tribunal, seja de natureza pecuniária, seja de ponto de controle para reprovação de suas contas. 4ª Sessão Virtual do Tribunal de Contas dos Municípios do Estado do Pará de 10 a 14 de março de 2025. Download Anexo - Relatório e Voto do Relator  DO GABINETE DO VICE-PRESIDENTE DECISÃO MONOCRÁTICA CONS. DANIEL LAVAREDA DECISÃO MONOCRÁTICA DA VICE-PRESIDÊNCIA (JUÍZO DE ADMISSIBILIDADE DE RECURSO ORDINÁRIO) Processo nº: 1.010002.2023.2.0010 Processo Apensado: 010002.2023.2.000 Classe: Recurso Ordinário Procedência: Câmara Municipal de Aveiro Responsável: Antônio Elidio da Freita Silva Decisão Recorrida: Acórdão nº 46.379/2024 Assunto: Contas Anuais de Gestão Exercício: 2023 Tratam os autos de Recurso Ordinário, interposto pelo Sr. ANTONIO ELIDIO DA FREITA SILVA, responsável legal pela prestação de contas anuais da CÂMARA MUNICIPAL DE AVEIRO, exercício financeiro de 2023, com arrimo no art. 81, caput, da LC nº. 109/2016 c/c art. 604 e seguintes do RITCM-PA (Ato 23), contra a decisão contida na"
}