{
  "categoria": "acordao",
  "sessao": "27 a 31 de janeiro de 2025",
  "numero": "46.577",
  "publicacao": "26/3/2025",
  "numero_diario": "1.917",
  "processo": "014548.2023.2.000",
  "município": "Belém",
  "gestora": "Guarda Municipal",
  "exercício": "2023",
  "assunto": "Contas Anuais De Gestão",
  "interessado(s)": "Joel Monteiro Ribeiro (01.01 a 31.01.2023 e 03.03 a 13.08.2023) CPF Nº 265.775.422-87; Sindeval de Castro Tavares Bittencourt (01.02 02.03.2023 e 14.08 a 31.12.2023) CPF Nº 392.467.362-49",
  "contador(a)": "Marco Assis de Souza Aguiar",
  "instrução": "1ª Controladoria",
  "relatora": "Conselheira Ann Pontes",
  "ementa": "PRESTAÇÃO DE CONTAS DE GESTÃO. GUARDA MUNICIPAL DE BELÉM. EXERCÍCIO 2023. 1. SEGUNDO O SETOR TÉCNICO RESTOU A SEGUINTE IRREGULARIDADE CONSTATADA EM PROCESSOS LICITATÓRIOS ENCAMINHADOS NO MURAL DE LICITAÇÃO NO PERÍODO DE 03.03 A 13.08.2023 DO ORDENADOR JOEL MONTEIRO RIBEIRO. NÃO FORAM CONSTATADAS IRREGULARIDADES NOS OUTROS PERÍODOS. 2. PELA REGULARIDADE DAS CONTAS DO ORDENADOR JOEL MONTEIRO RIBEIRO NO PERÍODO DE 01.01 A 31.01.2023. E DO ORDENADOR SINDEVAL DE CASTRO TAVARES BITTENCOURT NOS PERÍODOS DE 01.02 A 02.03.2023 E 14.08 A 31.12.2023 ALVARÁ DE QUITAÇÃO. PELA REGULARIDADE COM RESSALVAS DO PERÍODO DE 03.03 A 13.08.2023 ORDENADOR JOEL MONTEIRO RIBEIRO. MULTA AO FUMREAP. ALVARÁ DE QUITAÇÃO. ACORDAM os Conselheiros do Tribunal de Contas dos Municípios do Estado do Pará, por votação unânime, em conformidade com a ata da sessão e nos termos do relatório e voto da Conselheira Relatora:",
  "decisão": "I. VOTAM nos termos do inciso I, do art. 45 da Lei Complementar Estadual nº 109/2016, pela REGULARIDADE das Contas da Guarda Municipal de Belém, exercício financeiro de 2023, período de 01.01 a 31.01.2023, de responsabilidade do Sr. Joel Monteiro Ribeiro, em favor de quem deverá ser expedido o Alvará de Quitação das despesas ordenadas, no valor de R$-17.669.658,84 (dezessete milhões, seiscentos e sessenta e nove mil, seiscentos e cinquenta e oito reais e oitenta e quatro centavos). Pela pela REGULARIDADE, COM RESSALVAS, das Contas da Guarda Municipal de Belém, exercício financeiro de 2023, período de 03.03 a 13.08.2023, de responsabilidade do Sr. Joel Monteiro Ribeiro, em favor de quem deverá ser expedido o Alvará de Quitação das despesas ordenadas, no valor de R$-77.850.115,71 (setenta e sete milhões, oitocentos e cinquenta mil, cento e quinze reais e setenta e um centavos), somente após a comprovação do recolhimento ao Fundo de Reaparelhamento do TCMPA/FUMREAP, no prazo de 30 (trinta) dias, do seguinte valor, a título de multa: 1) 300 UPF-PA, prevista no artigo 698, inciso IV, alínea “b”, do RI/TCM/PA, pelas irregularidades/impropriedades constatadas em processos licitatórios encaminhados ao Mural de Licitação, descumprindo parcialmente a IN Nº. 022/2021-TCM/PA c/c a Lei nº 8.666/93. II. VOTAM nos termos do inciso I, do art. 45, da Lei Complementar Estadual nº 109/2016, pela REGULARIDADE das Contas da Guarda Municipal de Belém, exercício financeiro de 2023, períodos de 01/02/2023 a 02/03/2023 e de 14/08/2023 a 31/12/2023, de responsabilidade do Sr. Sindeval de Castro Tavares Bittencourt, em favor de quem deve ser expedido o Alvará de Quitação pelas despesas ordenadas, respectivamente, nos valores de R$-14.463.559,42 (quatorze milhões, quatrocentos e sessenta e três mil, quinhentos e cinquenta e nove reais e quarenta e dois centavos) e R$-83.066.258,63 (oitenta e três milhões, sessenta e seis mil, duzentos e cinquenta e oito reais e sessenta e três centavos). III. Fica o Ordenador ciente, desde já, que o não recolhimento das multas aplicadas, na forma e prazo fixados, após o trânsito em julgado da presente decisão, resultará nos acréscimos decorrentes de mora, nos termos do art. 703, incisos I a III, do RI/TCM/PA e, ainda, no caso de não atendimento de referidas determinações, fica à Secretaria Geral/ TCM/PA autorizada a proceder com os trâmites necessários para o efetivo protesto e execução do título, na forma regimental. 1ª Sessão Virtual do Tribunal de Contas dos Municípios do Estado do Pará de 27 a 31 de janeiro de 2025. Os autos recursais foram autuados neste TCMPA em 18/03/2025 e encaminhados a esta Vice-Presidência em 24/03/2025, como indicam os autos. Nos termos do inciso II do art. 16 da LC nº. 109/20161, com redação estabelecida na forma da LC nº. 156/2022, recai a competência ao Vice-Presidente do Tribunal para fixar o juízo de admissibilidade dos Recursos Ordinários interpostos em desfavor das decisões colegiadas. É o breve relatório, pelo que passo a apreciação de admissibilidade, conforme regramento contido na Lei Orgânica e no Regimento Interno do TCMPA, nos seguintes termos: 1. DA LEGITIMIDADE Os legitimados para interpor Recurso Ordinário, em face de decisão proferida pelo Tribunal de Contas dos Municípios do Estado do Pará, encontram-se destacados no rol consignado pelo §2º, do art. 79 da LC nº. 109/20162. No caso em tela, verifica-se que o Recorrente, ordenador responsável pela prestação de contas anuais da GUARDA MUNICIPAL DE BELÉM, durante o exercício financeiro de 2023 (01.01 a 31.01.2023 e 03.03 a 13.08.2023), foi alcançado pela decisão constante no",
  "sample_texto": "ACÓRDÃO Nº 46.577 Processo nº 014548.2023.2.000 Município: Belém Unidade Gestora: Guarda Municipal E...",
  "ioepa": "https://tcm.ioepa.com.br/diarios/2025/2025.03.26.DOE.pdf",
  "local": {
    "caminho": "/home/joaompessoa/diario_oficial_tcmpa/diarios/2025/03/2025.03.26.DOE.pdf",
    "pdf": "2025.03.26.DOE.pdf"
  },
  "texto_original": "ACÓRDÃO Nº 46.577 Processo nº 014548.2023.2.000 Município: Belém Unidade Gestora: Guarda Municipal Exercício: 2023 Assunto: Contas Anuais De Gestão Interessado(s): Joel Monteiro Ribeiro (01.01 a 31.01.2023 e 03.03 a 13.08.2023) CPF Nº 265.775.422-87; Sindeval de Castro Tavares Bittencourt (01.02 02.03.2023 e 14.08 a 31.12.2023) CPF Nº 392.467.362-49 Contador(a): Marco Assis de Souza Aguiar Instrução: 1ª Controladoria Assunto: Prestação de Contas de Gestão MPCM/PA: Procuradora Maria Regina Cunha Relatora: Conselheira Ann Pontes EMENTA: PRESTAÇÃO DE CONTAS DE GESTÃO. GUARDA MUNICIPAL DE BELÉM. EXERCÍCIO 2023. 1. SEGUNDO O SETOR TÉCNICO RESTOU A SEGUINTE IRREGULARIDADE CONSTATADA EM PROCESSOS LICITATÓRIOS ENCAMINHADOS NO MURAL DE LICITAÇÃO NO PERÍODO DE 03.03 A 13.08.2023 DO ORDENADOR JOEL MONTEIRO RIBEIRO. NÃO FORAM CONSTATADAS IRREGULARIDADES NOS OUTROS PERÍODOS. 2. PELA REGULARIDADE DAS CONTAS DO ORDENADOR JOEL MONTEIRO RIBEIRO NO PERÍODO DE 01.01 A 31.01.2023. E DO ORDENADOR SINDEVAL DE CASTRO TAVARES BITTENCOURT NOS PERÍODOS DE 01.02 A 02.03.2023 E 14.08 A 31.12.2023 ALVARÁ DE QUITAÇÃO. PELA REGULARIDADE COM RESSALVAS DO PERÍODO DE 03.03 A 13.08.2023 ORDENADOR JOEL MONTEIRO RIBEIRO. MULTA AO FUMREAP. ALVARÁ DE QUITAÇÃO. ACORDAM os Conselheiros do Tribunal de Contas dos Municípios do Estado do Pará, por votação unânime, em conformidade com a ata da sessão e nos termos do relatório e voto da Conselheira Relatora: DECISÃO: I. VOTAM nos termos do inciso I, do art. 45 da Lei Complementar Estadual nº 109/2016, pela REGULARIDADE das Contas da Guarda Municipal de Belém, exercício financeiro de 2023, período de 01.01 a 31.01.2023, de responsabilidade do Sr. Joel Monteiro Ribeiro, em favor de quem deverá ser expedido o Alvará de Quitação das despesas ordenadas, no valor de R$-17.669.658,84 (dezessete milhões, seiscentos e sessenta e nove mil, seiscentos e cinquenta e oito reais e oitenta e quatro centavos). Pela pela REGULARIDADE, COM RESSALVAS, das Contas da Guarda Municipal de Belém, exercício financeiro de 2023, período de 03.03 a 13.08.2023, de responsabilidade do Sr. Joel Monteiro Ribeiro, em favor de quem deverá ser expedido o Alvará de Quitação das despesas ordenadas, no valor de R$-77.850.115,71 (setenta e sete milhões, oitocentos e cinquenta mil, cento e quinze reais e setenta e um centavos), somente após a comprovação do recolhimento ao Fundo de Reaparelhamento do TCMPA/FUMREAP, no prazo de 30 (trinta) dias, do seguinte valor, a título de multa: 1) 300 UPF-PA, prevista no artigo 698, inciso IV, alínea “b”, do RI/TCM/PA, pelas irregularidades/impropriedades constatadas em processos licitatórios encaminhados ao Mural de Licitação, descumprindo parcialmente a IN Nº. 022/2021-TCM/PA c/c a Lei nº 8.666/93. II. VOTAM nos termos do inciso I, do art. 45, da Lei Complementar Estadual nº 109/2016, pela REGULARIDADE das Contas da Guarda Municipal de Belém, exercício financeiro de 2023, períodos de 01/02/2023 a 02/03/2023 e de 14/08/2023 a 31/12/2023, de responsabilidade do Sr. Sindeval de Castro Tavares Bittencourt, em favor de quem deve ser expedido o Alvará de Quitação pelas despesas ordenadas, respectivamente, nos valores de R$-14.463.559,42 (quatorze milhões, quatrocentos e sessenta e três mil, quinhentos e cinquenta e nove reais e quarenta e dois centavos) e R$-83.066.258,63 (oitenta e três milhões, sessenta e seis mil, duzentos e cinquenta e oito reais e sessenta e três centavos). III. Fica o Ordenador ciente, desde já, que o não recolhimento das multas aplicadas, na forma e prazo fixados, após o trânsito em julgado da presente decisão, resultará nos acréscimos decorrentes de mora, nos termos do art. 703, incisos I a III, do RI/TCM/PA e, ainda, no caso de não atendimento de referidas determinações, fica à Secretaria Geral/ TCM/PA autorizada a proceder com os trâmites necessários para o efetivo protesto e execução do título, na forma regimental. 1ª Sessão Virtual do Tribunal de Contas dos Municípios do Estado do Pará de 27 a 31 de janeiro de 2025. Os autos recursais foram autuados neste TCMPA em 18/03/2025 e encaminhados a esta Vice-Presidência em 24/03/2025, como indicam os autos. Nos termos do inciso II do art. 16 da LC nº. 109/20161, com redação estabelecida na forma da LC nº. 156/2022, recai a competência ao Vice-Presidente do Tribunal para fixar o juízo de admissibilidade dos Recursos Ordinários interpostos em desfavor das decisões colegiadas. É o breve relatório, pelo que passo a apreciação de admissibilidade, conforme regramento contido na Lei Orgânica e no Regimento Interno do TCMPA, nos seguintes termos: 1. DA LEGITIMIDADE Os legitimados para interpor Recurso Ordinário, em face de decisão proferida pelo Tribunal de Contas dos Municípios do Estado do Pará, encontram-se destacados no rol consignado pelo §2º, do art. 79 da LC nº. 109/20162. No caso em tela, verifica-se que o Recorrente, ordenador responsável pela prestação de contas anuais da GUARDA MUNICIPAL DE BELÉM, durante o exercício financeiro de 2023 (01.01 a 31.01.2023 e 03.03 a 13.08.2023), foi alcançado pela decisão constante no"
}