{
  "categoria": "acordao",
  "sessao": "01 de novembro de 2024",
  "numero": "46.073",
  "publicacao": "25/3/2025",
  "processo": "Processo nº 244012005",
  "assunto": "Recurso de Reconsideração (Recurso Ordinário)",
  "município": "Castanhal",
  "órgão": "Secretaria Municipal de Transporte e Trânsito",
  "recorrentes": "João Sampaio de Oliveira (CPF: 083.957.212-10) (01/01 a 31/08/2005) e Waldir Nascimento Batista (CPF: 587.875.502-90) (01/09 a 31/12/2005) Procurador/Advogado(a): Elvis Ribeiro da Silva (OAB-PA 12.114)",
  "instrução": "3ª Controladoria",
  "contas": "Procurador Marcelo Fonseca Barros",
  "relatoria": "Conselheira Mara Lúcia",
  "exercício": "2005",
  "ementa": "RECURSO DE RECONSIDERAÇÃO (RECURSO ORDINÁRIO). SECRETARIA MUNICIPAL DE TRANSPORTE E TRÂNSITO DE CASTANHAL. EXERCÍCIO DE 2005. NO PERÍODO DE RESPONSABILIDADE DO ORDENADOR JOÃO SAMPAIO DE OLIVEIRA, CONSTATOU-SE O NÃO ENCAMINHAMENTO DE PROCEDIMENTO LICITATÓRIO E NOTAS DE EMPENHO. INCIDÊNCIA DA PRESCRIÇÃO INTERCORRENTE NA PRETENSÃO SANCIONATÓRIA, NOS TERMOS DO ART. 78-I DA LEI COMPLEMENTAR ESTADUAL Nº. 109/2016. CONHECER DO RECURSO E DAR-LHE PROVIMENTO, REFORMANDO INTEGRALMENTE, A DECISÃO ANTERIORMENTE PROLATADA. NO PERÍODO DE RESPONSABILIDADE DO ORDENADOR WALDIR NASCIMENTO BATISTA, CONTAS JULGADAS REGULARES E NO PERÍODO DE RESPONSABILIDADE DO ORDENADOR JOÃO SAMPAIO DE OLIVEIRA, CONTAS JULGADAS REGULARES, COM RESSALVAS. EXPEDIÇÃO DE ALVARÁS DE QUITAÇÃO. Vistos, relatados e discutidos os presentes autos que tratam do RECURSO DE RECONSIDERAÇÃO/ORDINÁRIO, com amparo no art. 65 da Lei Complementar nº 25/1994, vigente à época, atualmente denominado de Recurso Ordinário (conforme art. 81, da LC nº. 109/2016), pugnando pela reforma do Acórdão nº 19.570, de 30.03.2010 (fls. 436/437), com decisão pela irregularidade, das contas, da Secretaria Municipal de Transporte e Trânsito de Castanhal, exercício 2005, ACORDAM os Conselheiros do Tribunal de Contas dos Municípios do Estado do Pará, de acordo com a Ata da sessão e do Relatório e Voto da Conselheira Relatora, por unanimidade,",
  "decisão": "Conhecer do recurso interposto e dar-lhe provimento, reformando integralmente o Acórdão nº 19.570, de 30.03.2010, para, com fundamento no art. 45, inciso I, da LC Estadual nº 109/2016, considerar REGULARES as contas de Waldir Nascimento Batista (01/09 a 31/12/2005), e com base no art. 45, inciso II, da referida Lei Orgânica deste TCM-PA e julgar REGULARES, COM RESSALVAS, as contas de João Sampaio de Oliveira (01/01 a 31/08/2005), na condição de ordenadores de despesa da Secretaria Municipal de Transporte e Trânsito de Castanhal, no exercício financeiro de 2005, aos quais devem ser emitidos Alvarás de Quitação nos valores respectivos de R$-201.427,88 (duzentos e um mil, quatrocentos e vinte e sete reais e oitenta e oito centavos) e R$-310.355,14 (trezentos e dez mil, trezentos e cinquenta e cinco reais e quatorze centavos), sem o recolhimento de multa, em virtude da incidência da prescrição intercorrente, nos termos do art. 78-I da Lei Complementar Estadual nº. 109/2016. Sala das Sessões do Plenário Virtual do Tribunal de Contas dos Municípios do Estado do Pará, de 29 de outubro a 01 de novembro de 2024. Download Anexo - Relatório e Voto do Relator ACÓRDÃO 46.650 Processo nº 201705465-00 Município: Igarapé-Miri Órgão: Prefeitura Municipal Assunto: Representação Exercício: 2017",
  "representado": "Prefeitura Municipal – Ronélio Antônio R. Quaresma – CPF: 563.061.562-91",
  "representante": "José Maria Costeira – CPF: 362.048.202-06",
  "relator": "",
  "conselheiro": "Luís Daniel Lavareda Reis Júnior",
  "procuradora": "Maria Inez Klautau de Mendonça Gueiros EMENTA: REPRESENTAÇÃO. PREFEITURA MUNICIPAL DE IGARAPÉMIRI. EXERCÍCIO 2017. PELA PROCEDÊNCIA. COMPROVAÇÃO DE IRREGULARIDADE. DESPESAS EMPENHADAS SEM COBERTURA CONTRATUAL. NÃO APLICAÇÃO DE MULTA E PENA DE RESSARCIMENTO AOS COFRES PÚBLICOS POR ESTE TRIBUNAL EM RAZÃO DA OCORRÊNCIA DO INSTITUTO DA PRESCRIÇÃO. JUNTADA A PRESTAÇÃO DE CONTAS. ENCAMINHAMENTO AO MINISTÉRIO PÚBLICO ESTADUAL PARA APURAÇÃO DE POSSÍVEL ATO DE IMPROBIDADE ADMINISTRATIVA UMA VEZ QUE NA SUA CARACTERIZAÇÃO COMO DOLOSO NÃO SE SUBMETE À PRESCRIÇÃO CONFORME TEMA 897 DO SUPREMO TRIBUNAL FEDERAL. ENCAMINHAMENTO À SECRETARIA PARA COMUNICAÇÃO AOS INTERESSADOS. Vistos, relatados e discutidos os presentes autos, que tratam da Representação interposta pelo Sr. José Maria Costeira, Vereador do município de Igarapé-Miri, em desfavor do Prefeito Municipal de Igarapé Miri, Sr. Ronélio Antônio Rodrigues Quaresma, exercício 2017, em razão de procedimentos licitatórios que estejam em desacordo com as Resoluções nº 11.535/14-TCM/PA (que instituiu o Mural de Licitações) e nº 11.831/2015-TCM/PA (que estabeleceu prazos, determinando aos jurisdicionados o envio eletrônico dos processos licitatórios ao Tribunal por meio do Mural de Licitações), pelo não envio dos processos licitatórios, dispensas e inexigibilidades, bem como a publicação no mural de licitações dos procedimentos licitatórios realizados pela municipalidade.3 DOE TCMPA Nº 1.916 Terça-feira, 25 de março de 2025 Consulta via leitora de QR Code/ Este Diário Oficial Eletrônico do TCMPA é GRATUITO e sua autenticidade poderá ser confirmada na página do Tribunal de Contas dos Municípios do Estado do Pará na Internet, no Endereço: diario-oficial-eletronico/ ACORDAM os Conselheiros do Tribunal de Contas dos Municípios do Estado do Pará, nos termos da Ata da sessão e do Relatório e Voto do Conselheiro Relator, por unanimidade. DECISÃO: Pela procedência da representação, ante a ausência de comprovação de inserção no Mural de Licitações de documentação comprobatória dos contratos firmados com diversos credores ou instrumentos substitutivos, nos seguintes termos: Por todo o exposto, no mérito, VOTO pela PROCEDÊNCIA DA REPRESENTAÇÃO protocolada. Entretanto, considerando a ocorrência do instituto prescricional, deixo de aplicar multa e pena de ressarcimento aos cofres públicos. Ademais, determino o encaminhamento dos autos ao Ministério Público Estadual para apuração de possível ato de improbidade administrativa, uma vez que na sua caracterização como doloso não se submete à prescrição, conforme Tema 897 do Supremo Tribunal Federal. Por fim, proceda-se à juntada a prestação de contas da Prefeitura Municipal de Igarapé-Miri, exercício financeiro de 2017, na forma do art. 512 do RI/TCM-PA. Encaminhamento dos autos à Secretaria-Geral para comunicação aos interessados na forma regimental. Sala das sessões do Tribunal de Contas dos Municípios do Estado do Pará, em 13 de fevereiro de 2025. Download Anexo - Relatório e Voto do Relator",
  "sample_texto": "ACÓRDÃO Nº 46.073 Processo nº 244012005-00 Assunto: Recurso de Reconsideração (Recurso Ordinário) Mu...",
  "diario": "",
  "ioepa": "https://tcm.ioepa.com.br/diarios/2025/2025.03.25.DOE.pdf",
  "local": {
    "caminho": "/home/joaompessoa/diario_oficial_tcmpa/diarios/2025/03/2025.03.25.DOE.pdf",
    "pdf": "2025.03.25.DOE.pdf"
  },
  "texto_original": "ACÓRDÃO Nº 46.073 Processo nº 244012005-00 Assunto: Recurso de Reconsideração (Recurso Ordinário) Município: Castanhal Órgão: Secretaria Municipal de Transporte e Trânsito Recorrentes: João Sampaio de Oliveira (CPF: 083.957.212-10) (01/01 a 31/08/2005) e Waldir Nascimento Batista (CPF: 587.875.502-90) (01/09 a 31/12/2005) Procurador/Advogado(a): Elvis Ribeiro da Silva (OAB-PA 12.114) Instrução: 3ª Controladoria/TCM Ministério Público de Contas: Procurador Marcelo Fonseca Barros Relatoria: Conselheira Mara Lúcia Exercício: 2005 EMENTA: RECURSO DE RECONSIDERAÇÃO (RECURSO ORDINÁRIO). SECRETARIA MUNICIPAL DE TRANSPORTE E TRÂNSITO DE CASTANHAL. EXERCÍCIO DE 2005. NO PERÍODO DE RESPONSABILIDADE DO ORDENADOR JOÃO SAMPAIO DE OLIVEIRA, CONSTATOU-SE O NÃO ENCAMINHAMENTO DE PROCEDIMENTO LICITATÓRIO E NOTAS DE EMPENHO. INCIDÊNCIA DA PRESCRIÇÃO INTERCORRENTE NA PRETENSÃO SANCIONATÓRIA, NOS TERMOS DO ART. 78-I DA LEI COMPLEMENTAR ESTADUAL Nº. 109/2016. CONHECER DO RECURSO E DAR-LHE PROVIMENTO, REFORMANDO INTEGRALMENTE, A DECISÃO ANTERIORMENTE PROLATADA. NO PERÍODO DE RESPONSABILIDADE DO ORDENADOR WALDIR NASCIMENTO BATISTA, CONTAS JULGADAS REGULARES E NO PERÍODO DE RESPONSABILIDADE DO ORDENADOR JOÃO SAMPAIO DE OLIVEIRA, CONTAS JULGADAS REGULARES, COM RESSALVAS. EXPEDIÇÃO DE ALVARÁS DE QUITAÇÃO. Vistos, relatados e discutidos os presentes autos que tratam do RECURSO DE RECONSIDERAÇÃO/ORDINÁRIO, com amparo no art. 65 da Lei Complementar nº 25/1994, vigente à época, atualmente denominado de Recurso Ordinário (conforme art. 81, da LC nº. 109/2016), pugnando pela reforma do Acórdão nº 19.570, de 30.03.2010 (fls. 436/437), com decisão pela irregularidade, das contas, da Secretaria Municipal de Transporte e Trânsito de Castanhal, exercício 2005, ACORDAM os Conselheiros do Tribunal de Contas dos Municípios do Estado do Pará, de acordo com a Ata da sessão e do Relatório e Voto da Conselheira Relatora, por unanimidade, DECISÃO: Conhecer do recurso interposto e dar-lhe provimento, reformando integralmente o Acórdão nº 19.570, de 30.03.2010, para, com fundamento no art. 45, inciso I, da LC Estadual nº 109/2016, considerar REGULARES as contas de Waldir Nascimento Batista (01/09 a 31/12/2005), e com base no art. 45, inciso II, da referida Lei Orgânica deste TCM-PA e julgar REGULARES, COM RESSALVAS, as contas de João Sampaio de Oliveira (01/01 a 31/08/2005), na condição de ordenadores de despesa da Secretaria Municipal de Transporte e Trânsito de Castanhal, no exercício financeiro de 2005, aos quais devem ser emitidos Alvarás de Quitação nos valores respectivos de R$-201.427,88 (duzentos e um mil, quatrocentos e vinte e sete reais e oitenta e oito centavos) e R$-310.355,14 (trezentos e dez mil, trezentos e cinquenta e cinco reais e quatorze centavos), sem o recolhimento de multa, em virtude da incidência da prescrição intercorrente, nos termos do art. 78-I da Lei Complementar Estadual nº. 109/2016. Sala das Sessões do Plenário Virtual do Tribunal de Contas dos Municípios do Estado do Pará, de 29 de outubro a 01 de novembro de 2024. Download Anexo - Relatório e Voto do Relator  ACÓRDÃO 46.650 Processo nº 201705465-00 Município: Igarapé-Miri Órgão: Prefeitura Municipal Assunto: Representação Exercício: 2017 Representado: Prefeitura Municipal – Ronélio Antônio R. Quaresma – CPF: 563.061.562-91 Representante: José Maria Costeira – CPF: 362.048.202-06 Relator: Conselheiro: Luís Daniel Lavareda Reis Júnior Procuradora: Maria Inez Klautau de Mendonça Gueiros EMENTA: REPRESENTAÇÃO. PREFEITURA MUNICIPAL DE IGARAPÉMIRI. EXERCÍCIO 2017. PELA PROCEDÊNCIA. COMPROVAÇÃO DE IRREGULARIDADE. DESPESAS EMPENHADAS SEM COBERTURA CONTRATUAL. NÃO APLICAÇÃO DE MULTA E PENA DE RESSARCIMENTO AOS COFRES PÚBLICOS POR ESTE TRIBUNAL EM RAZÃO DA OCORRÊNCIA DO INSTITUTO DA PRESCRIÇÃO. JUNTADA A PRESTAÇÃO DE CONTAS. ENCAMINHAMENTO AO MINISTÉRIO PÚBLICO ESTADUAL PARA APURAÇÃO DE POSSÍVEL ATO DE IMPROBIDADE ADMINISTRATIVA UMA VEZ QUE NA SUA CARACTERIZAÇÃO COMO DOLOSO NÃO SE SUBMETE À PRESCRIÇÃO CONFORME TEMA 897 DO SUPREMO TRIBUNAL FEDERAL. ENCAMINHAMENTO À SECRETARIA PARA COMUNICAÇÃO AOS INTERESSADOS. Vistos, relatados e discutidos os presentes autos, que tratam da Representação interposta pelo Sr. José Maria Costeira, Vereador do município de Igarapé-Miri, em desfavor do Prefeito Municipal de Igarapé Miri, Sr. Ronélio Antônio Rodrigues Quaresma, exercício 2017, em razão de procedimentos licitatórios que estejam em desacordo com as Resoluções nº 11.535/14-TCM/PA (que instituiu o Mural de Licitações) e nº 11.831/2015-TCM/PA (que estabeleceu prazos, determinando aos jurisdicionados o envio eletrônico dos processos licitatórios ao Tribunal por meio do Mural de Licitações), pelo não envio dos processos licitatórios, dispensas e inexigibilidades, bem como a publicação no mural de licitações dos procedimentos licitatórios realizados pela municipalidade.\n3 DOE TCMPA Nº 1.916 Terça-feira, 25 de março de 2025    Consulta via leitora de QR Code/ Este Diário Oficial Eletrônico do TCMPA é GRATUITO e sua autenticidade poderá ser confirmada na página do Tribunal de Contas dos Municípios do Estado do Pará na Internet, no Endereço: diario-oficial-eletronico/ ACORDAM os Conselheiros do Tribunal de Contas dos Municípios do Estado do Pará, nos termos da Ata da sessão e do Relatório e Voto do Conselheiro Relator, por unanimidade. DECISÃO: Pela procedência da representação, ante a ausência de comprovação de inserção no Mural de Licitações de documentação comprobatória dos contratos firmados com diversos credores ou instrumentos substitutivos, nos seguintes termos: Por todo o exposto, no mérito, VOTO pela PROCEDÊNCIA DA REPRESENTAÇÃO protocolada. Entretanto, considerando a ocorrência do instituto prescricional, deixo de aplicar multa e pena de ressarcimento aos cofres públicos. Ademais, determino o encaminhamento dos autos ao Ministério Público Estadual para apuração de possível ato de improbidade administrativa, uma vez que na sua caracterização como doloso não se submete à prescrição, conforme Tema 897 do Supremo Tribunal Federal. Por fim, proceda-se à juntada a prestação de contas da Prefeitura Municipal de Igarapé-Miri, exercício financeiro de 2017, na forma do art. 512 do RI/TCM-PA. Encaminhamento dos autos à Secretaria-Geral para comunicação aos interessados na forma regimental. Sala das sessões do Tribunal de Contas dos Municípios do Estado do Pará, em 13 de fevereiro de 2025.  Download Anexo - Relatório e Voto do Relator"
}