{
  "categoria": "acordao",
  "sessao": "25 de fevereiro de 2025",
  "numero": "46.757",
  "publicacao": "26/3/2025",
  "processo": "Processo nº 1.083001.2025.2.0008",
  "órgão": "Prefeitura Municipal",
  "município": "Tomé-Açu",
  "exercício": "2025",
  "assunto": "Homologação de Medida Cautelar Pregão Eletrônico nº 9-2025-2801001",
  "responsável": "Carlos Antônio Vieira – CPF: 159.131.121-72",
  "relator": "Conselheiro José Carlos Araújo",
  "ementa": "Prefeitura Municipal de Tomé-Açu. Exercício 2025. Homologação de Medida Cautelar. Pregão Eletrônico nº 9-20252801001. Notificar o ordenador de despesas. Aplicação de multas. ACORDAM os Conselheiros do Tribunal de Contas dos Municípios do Estado do Pará, por votação unânime, em conformidade com a ata da sessão e nos termos do relatório e decisão do Relator:",
  "decisão": "I – Homologar a Medida Cautelar, que sustou o Pregão Eletrônico nº 9-2025-2801001, promovido pela Prefeitura Municipal de Tomé-Açu; II – Notificar o ordenador da Prefeitura Municipal de Tomé-Açu, exercício de 2025, Carlos Antonio Vieira – CPF: 159.131.121-72, sobre a Medida Cautelar aplicada, para que no prazo de 05 (cinco) dias, se manifeste sobre as irregularidades apontadas pelo Órgão Técnico; III – Determinar ainda, aplicação de multa diária de 1.000 (um mil) UPF-PA, em caso de descumprimento desta decisão, de acordo com o art. 699, do RITCM-PA, Ato nº 24. Sala das Sessões do Tribunal de Contas dos Municípios do Estado do Pará, em 25 de fevereiro de 2025. Download Anexo - Relatório e Voto do Relator",
  "sample_texto": "ACÓRDÃO Nº 46.757 Processo nº 1.083001.2025.2.0008 Órgão: Prefeitura Municipal Município: Tomé-Açu E...",
  "diario": "",
  "ioepa": "https://tcm.ioepa.com.br/diarios/2025/2025.03.26.DOE.pdf",
  "local": {
    "caminho": "/home/joaompessoa/diario_oficial_tcmpa/diarios/2025/03/2025.03.26.DOE.pdf",
    "pdf": "2025.03.26.DOE.pdf"
  },
  "texto_original": "ACÓRDÃO Nº 46.757 Processo nº 1.083001.2025.2.0008 Órgão: Prefeitura Municipal Município: Tomé-Açu Exercício: 2025 Assunto: Homologação de Medida Cautelar Pregão Eletrônico nº 9-2025-2801001 Responsável: Carlos Antônio Vieira – CPF: 159.131.121-72 Relator: Conselheiro José Carlos Araújo EMENTA: Prefeitura Municipal de Tomé-Açu. Exercício 2025. Homologação de Medida Cautelar. Pregão Eletrônico nº 9-20252801001. Notificar o ordenador de despesas. Aplicação de multas. ACORDAM os Conselheiros do Tribunal de Contas dos Municípios do Estado do Pará, por votação unânime, em conformidade com a ata da sessão e nos termos do relatório e decisão do Relator: DECISÃO: I – Homologar a Medida Cautelar, que sustou o Pregão Eletrônico nº 9-2025-2801001, promovido pela Prefeitura Municipal de Tomé-Açu; II – Notificar o ordenador da Prefeitura Municipal de Tomé-Açu, exercício de 2025, Carlos Antonio Vieira – CPF: 159.131.121-72, sobre a Medida Cautelar aplicada, para que no prazo de 05 (cinco) dias, se manifeste sobre as irregularidades apontadas pelo Órgão Técnico; III – Determinar ainda, aplicação de multa diária de 1.000 (um mil) UPF-PA, em caso de descumprimento desta decisão, de acordo com o art. 699, do RITCM-PA, Ato nº 24. Sala das Sessões do Tribunal de Contas dos Municípios do Estado do Pará, em 25 de fevereiro de 2025. Download Anexo - Relatório e Voto do Relator"
}